"status_id","text","screen_name","created_at","favorite_count","retweet_count"
"1463815650825093131","Neben den drängensten Herausforderungen in diesem Land, gilt es auch den Osten und die ländlichen Räume in Ost wie West zu stärken. Dafür hat die neue Koalition im #Koalitionsvertrag viel erreicht und ich bin stolz darauf. Eine kleine Auswahl davon im Thread.","MiKellner",2021-11-25 10:23:42,61,10
"1463454065413828614","Ich freue mich darauf: Heute veröffentlichen wir den Koalitionsvertrag. Wenn Du dabei sein willst, dann schalte Livestream ab 15 Uhr auf https://t.co/Tm4K0TwNNg <U+0001F6A6> https://t.co/Dl9x5Rta6E","MiKellner",2021-11-24 10:26:53,411,47
"1462027110151770116","Vor den Koaverhandlungen heute war ich bei @GrueneBBG. Ich freue mich Brandenburg im Deutschen Bundestag zu vertreten. Und ich bin überzeugt, dass der Koalitionsvertrag Antworten auf die großen Herausforderungen, auch und gerade für Ostdeutschland, geben wird. https://t.co/4JezVDSDWJ","MiKellner",2021-11-20 11:56:40,59,4
"1460612747687829506","Wir bilden gerade ein tragfähiges Fundament für hoffentlich vier gute Regierungsjahre. Das ist ein intensiver, arbeitsamer und konstruktiver Prozess. Und deshalb gilt mit Blick bei den Verhandlungen vor allem Gründlichkeit vor Schnelligkeit. https://t.co/PaqMayH5Tk","MiKellner",2021-11-16 14:16:30,152,8
"1458011280963424258","Der #9November ein besonderes Datum der deutschen Geschichte. Ich denke an die Progrome und die Verfolgung von Jüd*innen. Und ich denke an Hoffnung auf Freiheit 1989. Ein Auftrag und Mahnung nie zu vergessen und die Demokratie und die offene Gesellschaft jeden Tag zu verteidigen. https://t.co/eofa9300P9","MiKellner",2021-11-09 09:59:12,351,19
"1457712287008141318","Kommt zum großen Bürgerenergie-Webinar am nächsten Mittwoch. Ich freu mich schon richtig auf die Diskussion u.a. wie die Energiewende neuen Wohlstand in den ländlichen Raum bringen kann. Zur Anmeldung: https://t.co/U9dZujl27B https://t.co/QpChc1E1TK","MiKellner",2021-11-08 14:11:06,31,6
"1456559613210513410","Als Wahlverlierer sich von Rechtsextremen ins Amt verhelfen zu lassen, das macht man nicht. @dieLinke @LinkePankow #Kemmerich #Thüringen https://t.co/O8H3rD1ZnC","MiKellner",2021-11-05 09:50:48,429,31
"1455492375699247106","Die #COP26 zeigt; Klimaschutz muss Querschnittsaufgabe der nächsten Bundesregierung sein. Klimaschutz muss in allen Ressorts und von allen Parteien betrieben werden. 

Im Gespräch mit @welt https://t.co/DqKoYPJ6sn https://t.co/FtW5d8SzRR","MiKellner",2021-11-02 11:09:58,79,9
"1454386746289004552","Eine Bemerkung zu umweltschädlichen Subventionen: da wollen wir ran - #PlastikundÖl #Dienstwagenprivileg…Der Erhöhung der #Pendlerpauschale haben wir vor zwei Jahren schon zugestimmt, auch jetzt steht sie nicht infrage, hat ja @abaerbock gerade erst wieder gesagt: https://t.co/NfmrZNtExh","MiKellner",2021-10-30 09:56:36,142,22
"1454011270101864449","Ich war heute bei der @IGMetall, weil die notwendige Transformation der Industrie sozial und ökologisch sein muss. Wir müssen dafür sorgen, dass klimafreundliche Technologie weiter in Deutschland und Europa produziert wird. https://t.co/wKB8SSMwnk","MiKellner",2021-10-29 09:04:35,113,10
"1453744048792027142","Das ist eine sehr gute Wahl für Nordrhein-Westfalen. Ich freue mich, dass @gruenenrw mit @MonaNeubaur an der Spitze in die #ltw22 gehen. Sie hat Brücken gebaut und Bündnisse geschmiedet. Sie ist die richtige, um NRW zur ersten klimaneutralen Industrieregion der Welt zu machen. https://t.co/tweaIf21jY","MiKellner",2021-10-28 15:22:45,103,2
"1453289005869584394","Ich bin bis heute froh, dass der Eiserne Vorhang 1989 gefallen ist. Wir brauchen keine neue Mauern. #Kretschmer","MiKellner",2021-10-27 09:14:34,600,45
"1452908277843599360","Heute ist ein besonderer Tag. Als neugewählter Abgeordneter nehme ich an der ersten Sitzung des neuen Bundestags teil und habe auch die große Ehre, Claudia Roth als Bundestagsvizepräsidentin wählen zu können. https://t.co/lwSIPyRFNH","MiKellner",2021-10-26 08:01:41,560,9
"1451198855920320512","Wir treten mit dem heutigen Tag in Koalitionsverhandlungen ein. Das wird ein komplexes Unterfangen. Wir planen Fachverhandlungen bis zum 10. November, dann ist die Hauptverhandlungsgruppe dran. 
In der Nikolauswoche wollen wir die Regierung bilden. https://t.co/1ihmWRuUoC","MiKellner",2021-10-21 14:49:03,289,18
"1449756485433581573","Die #Ampel steht auf Grün. Unser Parteitag macht den Weg für Koalitionsverhandlungen frei. Was für eine Woche. Dieses Land braucht eine Regierung der Tat. So eine Regierung werden wir jetzt in den Koalitionsverhandlungen bauen. https://t.co/UHUwoMlGfc","MiKellner",2021-10-17 15:17:35,391,26
"1448977265941954562","Die harte gemeinsame Arbeit hat sich gelohnt. Das Sondierungspapier ist eine richtig gute Grundlage für eine Fortschrittskoalition, die die Aufgaben unserer Zeit anpackt und den Aufbruch wagt. <U+0001F6A6>Wir empfehlen dem Länderrat am Sonntag die Aufnahme von Koalitionsverhandlungen.","MiKellner",2021-10-15 11:41:15,634,36
"1447274570919170053","Was bin ich froh, dass es noch kein Twitter gab, als ich 14 war. @xsarahleee hat sich für ihre alten Tweets entschuldigt. Ich will nicht in einer Gesellschaft leben, in der man sich nicht ändern kann. @xsarahleee beweist das mit ihrem Engagement jeden Tag. Volle Solidarität. https://t.co/Kii12BZARa","MiKellner",2021-10-10 18:55:21,1038,66
"1446829320895401985","Herzlichen Glückwunsch an @xsarahleee und  @Dzienus und ein riesiges Dankeschön an @annarmpeters und @oekofuzzi für eine großartige Arbeit. Danke @gruene_jugend <U+0001F49A><U+0001F49A><U+0001F44F><U+0001F3FB><U+0001F44F><U+0001F3FB><U+0001F64F><U+0001F64F>","MiKellner",2021-10-09 13:26:05,411,14
"1445416725684625415","Es gab in den letzten Tagen vier  Sondierungsgespräche. Aus zweien liest und hört man nix. Aus zweien werden angebliche Gesprächsinhalte an die Medien durchgestochen. Das fällt auf, liebe Union - und es nervt!","MiKellner",2021-10-05 15:52:56,8904,609
"1444290268426080262","Heute auf dem Länderrat haben wir die Wahlergebnisse besprochen. Es geht jetzt darum, das Land in eine klimaneutrale Zukunft zu führen, um Freiheit zu wahren und Ungleichheit abzubauen. Den Beschluss findet ihr hier: https://t.co/eAeodKizx0","MiKellner",2021-10-02 13:16:48,143,12
"1442180900842737679","Danke für diesen Zuspruch, all die Unterstützung und das Engagement von so vielen für einen Aufbruch in diesem Land. Die Gesellschaft will eine bessere Regierung und die Wähler*innen haben uns ein starkes Mandat dafür gegeben. Diese Hoffnung auf Veränderung gilt es umzusetzen.","MiKellner",2021-09-26 17:34:55,254,13
"1442032949826756608","Heute grün wählen, damit wir mit einer Klimaregierung den Wohlstand von morgen schaffen, damit wir die Ungleichheit in diesem reichen Land reduzieren und damit ich als starke ostdeutsche Stimme im nächsten Bundestag ackern darf. #btw2021 #Bundestagswahl https://t.co/LzuaeWWlrK","MiKellner",2021-09-26 07:47:01,464,59
"1441861184337051648","Eine lange Kampagne geht zu Ende - heute noch einmal kreuz und quer durch die Uckermark und den Barnim. Und dann morgen mit allen Stimmen Grün. #btw21 #BereitWeilIhrEsSeid https://t.co/hUMOgkCVBu","MiKellner",2021-09-25 20:24:29,198,7
"1441681573968023557","#bereit weil ihr es seid.

<U+0001F33B> Trefft mich heute in Angermünde, Schwedt, Prenzlau, Templin und zum Kneipenwahlkampf in Eberswalde 

Wer eine #Klimaregierung will, wählt morgen Grün.

#btw21 #uckermark #barnim https://t.co/TpGxkySRoE","MiKellner",2021-09-25 08:30:47,108,11
"1441407276091416581","#AlleFürsKlima Unzählige Menschen haben heute im ganzen Land auf den Straßen mehr Klimaschutz gefordert. 
Wer eine echte Klimaregierung will, wählt Sonntag grün.
#btw21 

<U+0001F4F8> @vanVillwock https://t.co/Ge0HGBhzif","MiKellner",2021-09-24 14:20:49,143,16
"1441353726912958469","Danke an @BerlinerNotizen für die Klarstellung. Ich hoffe, dass auch die Kollegen @larsklingbeil und @hubertus_heil ihre Tweets löschen. https://t.co/MwCgVAjyQR","MiKellner",2021-09-24 10:48:02,57,2
"1441351950398750720","Super Stimmung &amp; Platz der Republik ist so voll, dass niemand mehr drauf darf. Umliegende Straßen füllen sich auch immer mehr. #Klimastreik https://t.co/wTyMoPQ3rI","MiKellner",2021-09-24 10:40:58,717,60
"1441326342675394561","Bitte den gesamten Kontext sehen. Robert #Habeck hat gesagt, dass uns die SPD am liebsten ist. Jamaika war laut ihm damals „ein einziges Gewürge.“ Das kann ich bestätigen. #Jamaika #Ampel https://t.co/CwgX71kLAl","MiKellner",2021-09-24 08:59:13,212,36
"1441316535348260867","Eine Stimme für Union und SPD ist eine verschwendete Stimme, wenn es um Klimapolitik geht.
Lasst uns heute alle gemeinsam für echten Klimaschutz auf die Straße gehen. 
Für eine #Klimaregierung, die die Klimakrise ernst nimmt.
#AlleFürsKlima #btw21 https://t.co/WgPtgp0BMT","MiKellner",2021-09-24 08:20:15,263,52
"1441126464716304385","Eines wurde deutlich: eine Stimme für Union und SPD ist eine verschwendete Stimme, wenn es um Klimapolitik geht. #Schlussrunde #btw21","MiKellner",2021-09-23 19:44:58,759,85
"1441118357013499910",".@ABaerbock weist zu recht daraufhin, dass es eine Neudefinition der deutschen Außenpolitik braucht: Mit klarem Wertefundament und zusammen mit den Partnern in Europa mit einer Stimme zu sprechen. Diesen Aufbruch braucht Europa jetzt. #Schlussrunde #btw21","MiKellner",2021-09-23 19:12:45,232,24
"1441112797761339395","Unser Land verschuldet sich aktuell an der Zukunft. Mit maroden Schulen, schlechten Internet und langsamer Bahn kommen wir nicht in die Zukunft. @ABaerbock hat völlig recht, es braucht eine Investitionsregel. #Schlussrunde #Bundestagswahl21","MiKellner",2021-09-23 18:50:40,461,53
"1441049696819191812","In Südthüringen gibt es die ernsthafte Chance das Direktmandat für #Maaßen zu verhindern. Frank Ulrich hat beste Chancen dafür. Ich finde es unverantwortlich, dass sich die Linke nicht zu einem Aufruf für den aussichtsreichen Kandidaten durchringen kann. https://t.co/Vii89vsnL1","MiKellner",2021-09-23 14:39:55,779,105
"1440617879683043328","#Aufbruch für echten #Klimaschutz statt ein Weiter so mit Union oder SPD. Nur mit starken Grünen gibt es eine Regierung, die Klimaschutz ernsthaft anpackt. https://t.co/LIbOSiCbUS","MiKellner",2021-09-22 10:04:02,451,80
"1440574991804686348","Wer einem Querdenker eine öffentliche Bühne gibt, hat den Kompass falsch ausgerichtet. Es wäre Größe, wenn ihr diesen Spot zurückzieht, @cdu https://t.co/ucUNsQygks","MiKellner",2021-09-22 07:13:37,717,55
"1440287418863669258","Sehr gut, Danke an die Stadt Zwickau,  die gegen die ursprüngliche Entscheidung vorgegangen ist. https://t.co/iojT3eWK0r","MiKellner",2021-09-21 12:10:54,191,17
"1440221009735389188","Was für eine bittere Klima-Bilanz von Olaf Scholz: er hat gebremst, wo er nur konnte. Es wäre nur ehrlich, wenn er seine Klimaplakate wieder abhängt. #Etikettenschwindel. #KeinWeiterSo #btw21 #Bundestagswahl 
https://t.co/iwbaF7DEma","MiKellner",2021-09-21 07:47:01,700,169
"1439981596824715268","Landgericht verbietet einstweilig Plakate ""Hängt die Grünen!"" Wichtiger Erfolg für die politische Kultur in unserem Land. https://t.co/MKlAZb1PiC","MiKellner",2021-09-20 15:55:40,547,40
"1439951917166301192","Das ist ein historisches Ergebnis der #U18Wahl. Erstmals sind wir bei einer U18 Bundestagswahl stärkste Kraft. Das zeigt vor allem, wie viel Hoffnung auf uns Grünen liegt und wie stark der Wunsch nach Veränderung in der jungen Generation ist. #btw21 https://t.co/QHR7oAqbfp","MiKellner",2021-09-20 13:57:44,1474,205
"1439682803956846594","Weil Robert #Habeck heute immer wieder falsch interpretiert wird, hier das Video, was er eigentlich gesagt hat. Er bezieht sich klar auf die Debatte mit den politischen Mitbewerbern. #btw21 https://t.co/QHtV3XaSDL","MiKellner",2021-09-19 20:08:23,419,78
"1439674770304417804","Olaf Scholz meint Digitalisierung wird in diesem Jahrzehnt (!!!!) gelingen. Auweia und das 2021… #triell","MiKellner",2021-09-19 19:36:27,647,39
"1439671279452311559","Olaf Scholz: „Wir haben versucht es ein bisschen durchzusetzen“. So kann man sozialdemokratische Politik auch beschreiben. #triell #btw21","MiKellner",2021-09-19 19:22:35,749,77
"1439667779175583744","Baerbock nimmt Laschet auseinander und Scholz gibt dazu den Sidekick. Das #Triell gefällt mir.","MiKellner",2021-09-19 19:08:40,5099,276
"1439667265406963718","#Freiheit und #Wohlstand gibt es zukünftig nur klimaneutral! #Triell","MiKellner",2021-09-19 19:06:38,71,4
"1439665446601568256","Baerbock erklärt Klimaschutz - Laschet und Scholz <U+0001F440> <U+0001F440> <U+0001F440> #Triell #btw21","MiKellner",2021-09-19 18:59:24,511,43
"1439663285729701889","Armin Laschet strickt an der Mär von faulen Arbeitslosen, die Hartz 4 beziehen und nichts leisten wollen. Das ist unwürdig. #Trielle #triell https://t.co/p9tsdOICiT","MiKellner",2021-09-19 18:50:49,132,11
"1439661790300971009","Die #Union will Steuern für die Reichsten senken. Das vertieft die soziale Spaltung und es fehlt bei der Unterstützung für Familien, Kinder und Alleinerziehende #Triell","MiKellner",2021-09-19 18:44:53,101,8
"1439659693262229505","#Laschet ist tatsächlich in den 90ern stecken geblieben mit der Ablehnung eines höheren Mindestlohns. Der aktuelle Mindestlohn von 9,60€ ist nicht armutsfest. #Triell","MiKellner",2021-09-19 18:36:33,196,18
"1439658273309925390","Beim #Triell hat @ABaerbock von Anfang an Kinder und Familien im Blick. https://t.co/YrgvoP864D","MiKellner",2021-09-19 18:30:54,108,7
"1439658056921518081","Wir brauchen einen Mindestlohn von 12 Euro und eine Kindergrundsicherung. Wichtige Forderungen von @ABaerbock #triell","MiKellner",2021-09-19 18:30:02,445,40
"1439582436128694278","Diese Umbruchszeit zwingt uns zu Antworten. Wer sie nicht gibt, endet in Verantwortungslosigkeit. Es braucht eine Regierung, die politische Spielräume wirklich nutzt. Kämpfen wir für den Aufbruch, kämpfen wir für starke @Die_Gruenen. Fulminanter Abschluss von Robert #Habeck. #btw","MiKellner",2021-09-19 13:29:33,182,19
"1439553876814925828","Was für ein starker Anspruch auf Gestaltung und Aufbruch in Deutschland. Und eine Kampfansage an die Mitbewerber. Mit klaren Blick auf die Probleme der Menschen und einer Vision für den klimaneutralen Wohlstand. Europäisch und gerecht. Aufbruch gibt es mit Mut &amp; @ABaerbock #btw21 https://t.co/fhAkE5LCUY","MiKellner",2021-09-19 11:36:04,398,37
"1439540754666430467","Winfried Kretschmann mit der entscheidenden Frage aus der Regierungswirklichkeit: Wer kann den notwendigen Wandel stemmen? Die, die es schon 16 Jahre nicht gemacht haben sicher nicht. @ABaerbock hat die Tatkraft und den Schwung das nötige auch umzusetzen. #btw21 #Wahlparteitag","MiKellner",2021-09-19 10:43:55,461,64
"1439191442908454912","In Schwedt mit unserer Grünen Bürgermeisterkandidatin Elisabeth Becker @GrueneSDT und tollen Freiwilligen säckeweise Müll gesammelt.
#WorldCleanUpDay #EsGibtKeinenPlanetB https://t.co/b8OjL5b78q https://t.co/mDhTdSZiW3","MiKellner",2021-09-18 11:35:53,68,3
"1438903236610637830","Zwischen Wahlkampfstand und Haustürwahlkampf: Besuch mit @lidl Deutschland-Chef in Templin und Austausch über regionale Vermarktung, Kreislaufwirtschaft, Plastikreduktion und Tierhaltung. Spannend, was sich im Einzelhandel tut. https://t.co/0Nj8Djbcx0","MiKellner",2021-09-17 16:30:39,65,1
"1438886349394915328","https://t.co/Nqpu168IEN https://t.co/gDQh8eTUtE","MiKellner",2021-09-17 15:23:33,175,18
"1438858615851470849","Kommt, wir ändern die Politik. #Aufbruch #btw21 https://t.co/YEDz7CxO9r","MiKellner",2021-09-17 13:33:21,682,51
"1438796099700068352","Was für ein starkes Aufbruchsignal: Erstwähler*innen wollen @ABaerbock. Und jetzt alle mit Eltern und Großeltern reden ;-) 
https://t.co/dbWoGPovpl https://t.co/5fLXMUajwT","MiKellner",2021-09-17 09:24:56,724,99
"1438580364608425993","Schulbildung als soziale Aufgabe begreifen. Das ist die Vision von @ABaerbock. Das zeigt; sie hat einen klaren Kompass wie wir das Land besser und gerecht machen. #Klartext #btw21","MiKellner",2021-09-16 19:07:41,355,29
"1438579947103297540",".@ABaerbock hat einen Plan für die Energiewende und sie will, dass die Gemeinden von der Energieproduktion vor Ort profitieren. Es braucht eine Energiewende, von der alle profitieren können. #btw21 #Klartext","MiKellner",2021-09-16 19:06:01,689,65
"1438572866568609793","Super, emphatischer Einstieg von @ABaerbock. Klar, kann Deutschland nicht allein Klimaschutz machen. Deshalb will @ABaerbock eine transatlantische Klima-Allianz. Europa und die USA würden damit vorangehen und Druck beim Klimaschutz machen. #Klartext","MiKellner",2021-09-16 18:37:53,1407,100
"1438427842564530176","Paukenschlag in Sachsen-Anhalt - Anti-Klima-Koalition fällt im ersten Wahlgang durch https://t.co/Osuv8nNTym","MiKellner",2021-09-16 09:01:37,185,19
"1438174057204158466","#Afd umgeht Parteienfinanzierung. Danke @correctiv_org, @derspiegel und @ZDFfrontal für diese Recherche. #Staatsanwaltschaft muss jetzt übernehmen. Auch #Ströer sollte seiner demokratischen Verantwortung gerecht werden und zur Transparenz beitragen. Da darf nicht gemauert werden. https://t.co/Jgy3rnfhzB","MiKellner",2021-09-15 16:13:09,87,23
"1438123262974771208","Danke an @wanderwitz stellvertretend für alle, die uns parteiübergreifend unterstützen. Für die Demokratie, gegen Hass und Hetze. #Bundestagswahl","MiKellner",2021-09-15 12:51:19,323,17
"1438080706949824516","Wer #HartzIV bekommt, wird mit den drei Euro mehr weiterhin von der #Groko im Stich gelassen. Es braucht endliche eine grundlegende Reform. Das soziokulturelle Existenzminimum muss neu und ehrlich berechnet und der Regelsatz schnell um 50 Euro angehoben werden.","MiKellner",2021-09-15 10:02:13,458,46
"1437760276997287938","Ich verstehe dieses Urteil nicht. Aufforderungen zu Gewalt haben in unserem Land nichts verloren. Wir werden rechtlich dagegen vorgehen. https://t.co/fvu5L21Ph8","MiKellner",2021-09-14 12:48:56,1713,121
"1437740751820046337","Ganz egal, wer sie anführt: noch eine Stillstands-Groko, wäre fatal für unser Land. Deutschland braucht einen #Aufbruch, den gibt es mit #Grün. https://t.co/DmU0sNjZjb","MiKellner",2021-09-14 11:31:21,647,63
"1437722757953896452","Tolle Aktion! Mit den Enkelkinderbriefen rufen junge Menschen dazu auf, bei der Bundestagswahl Klimaschutz zu wählen.  
Teilt die Aktion und macht mit. Ich kann das nur unterstützen. #Bundestagswahl 

https://t.co/m41yR0pJK8

https://t.co/aX2kJ2lxY2","MiKellner",2021-09-14 10:19:51,372,67
"1437447879430377472","TV Tipp: Heute Abend, um 23:30 Uhr, bin ich bei #beisenherz auf @ntvde. Mit @MickyBeisenherz und @fazbub diskutiere ich die Themen der letzten Woche. Schaltet gerne ein. <U+0001F4FA>","MiKellner",2021-09-13 16:07:35,62,7
"1437440338625540101","“Dem Sofortprogrämmchen fehlt der Plan"" #Laschet #btw  https://t.co/z2N2f0fxaI","MiKellner",2021-09-13 15:37:37,170,26
"1437322391634550787","Niedersachsen wird Grüner. Wir werden stärkste Kraft in Hannover, Lüneburg, Göttingen, Oldenburg und Osnabrück und gewinnen deutlich im ganzen Land dazu. Danke an unsere engagierten @gruenelvnds. Das gibt Rückenwind auf dem Weg zur #Bundestagswahl. #kommunalwahl2021","MiKellner",2021-09-13 07:48:56,1798,181
"1437141698543595523","Starkes Schlussplädoyer von @abaerbock: Unsere Enkel sollen uns nicht fragen ""Warum habt ihr nichts getan?"" sondern ""Wie habt ihr das geschafft?""

Die nächste Regierung ist die letzte, die die Klimakrise noch wirksam bekämpfen kann. Darum geht's bei der #btw21 #Triell","MiKellner",2021-09-12 19:50:56,5653,626
"1437140031370579970","Die #Union will Steuern vor allem für Reiche senken, das ist ungerecht und geht auf Kosten der dringend nötigen Zukunftsinvestitionen #Triell","MiKellner",2021-09-12 19:44:18,189,24
"1437137717301846026","Armin Laschet redet von einem starken Gesundheitssystem, während ein Drittel der Pflegekräfte über Kündigung nachdenkt und der GroKo nicht viel mehr eingefallen ist, als sie auf dem Balkon zu beklatschen. #triell #Bundestagswahl21","MiKellner",2021-09-12 19:35:07,1103,152
"1437134531690221576","Union &amp; SPD werfen sich ihre Blockadepolitik beim Klimaschutz vor. @ABaerbock dazu: ""Sie beide haben deutlich gemacht, dass sie sich nicht an Lösungen orientieren, sondern gegenseitig die Schuld in die Schuhe schieben. Klar ist: Wir müssen deutlich vor 2038 aus der Kohle raus!""","MiKellner",2021-09-12 19:22:27,323,48
"1437131935063621637","Armin Laschet trauert der Kernenergie nach und laviert bei der Energiewende herum - klar ist: Das Bundesverfassungsgericht musste die fatale Klimapolitik der GroKo korrigieren - mit Union und SPD wird es keinen Aufbruch geben. #Triell","MiKellner",2021-09-12 19:12:08,525,65
"1437130691511267332","Halbzeit: Annalena #Baerbock präsentiert Lösungen für den #Aufbruch, die #GroKo aus SPD und Union streitet und bleibt im Gestern. #Triell #Bundestagswahl21","MiKellner",2021-09-12 19:07:12,187,20
"1437129103052877831","Zum Thema Digitalisierung sagt Armin Laschet nach 16 Jahren CDU-geführter Regierung: ""Wir haben nicht genug gemacht"". Stimmt. Zeit für Aufbruch mit grün! #Triell #Bundestagswahl21","MiKellner",2021-09-12 19:00:53,143,17
"1437127866169364480","Klartext von @abaerbock zu Corona: ""Hier kann es aus meiner Sicht kein Rumgeiere geben: Wenn wir vor der Entscheidung stehen: Schließen wir wieder Kitas und Schulen oder reden wir über eine Impfpflicht für einzelne Berufsgruppen?"" #triell #Bundestagswahl21","MiKellner",2021-09-12 18:55:58,163,18
"1437127420394541067","Gute Stimmung beim #Triell mit @aminajxx und @k_herfurth. https://t.co/SZjW20x6em","MiKellner",2021-09-12 18:54:12,250,6
"1437124556960018433","Armin Laschet drückt sich vor einer klaren Aussage zu Maaßen. Damit macht er die Tore nach Rechtsaußen auf, statt sie entscheiden zu schließen. #Triell #Bundestagswahl21","MiKellner",2021-09-12 18:42:49,630,55
"1437121383373447174","Olaf Scholz versucht im #Triell, die Durchsuchung in seinem Ministerium herunterzuspielen. Klar ist: Er trägt die Verantwortung dafür, was in seinem Haus passiert und muss hier für Aufklärung sorgen. #Bundestagswahl21","MiKellner",2021-09-12 18:30:12,511,64
"1437119543936172037","Deutschland kann mehr. Wir brauchen jetzt den #Aufbruch. Recht hat @abaerbock #Triell #Bundestagswahl21","MiKellner",2021-09-12 18:22:54,120,10
"1437106806392856579","Angekommen. #Triell #Bundestagswahl https://t.co/vDVLM1eHJf","MiKellner",2021-09-12 17:32:17,359,23
"1436766726474113026","Markus #Söder lässt die Katze aus dem Sack und plädiert für eine neue Stillstands-GroKo. Einen Aufbruch und das Ende des Weiter-So gibt es nur mit Grün. https://t.co/3Fmp2CvYUA","MiKellner",2021-09-11 19:00:56,470,96
"1436415922969976853","Mit dieser Aussage wird  Wolfgang #Schäuble seiner Verantwortung als Bundestagspräsident in keiner Weise gerecht. Wir setzen alles daran, den Einzug von #Maaßen in den Bundestag zu verhindern. https://t.co/aV5mncPGpW","MiKellner",2021-09-10 19:46:58,867,110
"1436389973796732928","Das Verkehrsministerium als Beute für die #CSU #Scheuer abwählen #Verkehrswende jetzt https://t.co/RjO8dQCnj4","MiKellner",2021-09-10 18:03:51,178,24
"1436261937873133569","Spot Teil 2. Dieses Mal singen wir nicht. <U+0001F609> schaut rein. https://t.co/OIAFLZEvci","MiKellner",2021-09-10 09:35:05,1378,110
"1436243815212494854","Erst #CumEx, dann #Wirecard, jetzt die Razzia im BMF weil die zuständige Behörde bei Geldwäsche nicht aktiv wurde. Eines wird deutlich, bei Finanzbetrug hat Olaf #Scholz eine gefährliche Sehschwäche. https://t.co/VMKYiGQm4V","MiKellner",2021-09-10 08:23:04,304,63
"1435946877002862597","Die Klimakrise einzudämmen, ist die drängendste Aufgabe unserer Zeit. Dafür müssen wir jetzt ins Handeln kommen! Union und SPD liegen mit ihren Vorschlägen meilenweit hinter dem Notwendigen zurück. Deshalb gilt: Wer Klimaschutz will, muss Grün wählen. https://t.co/iUiEO3ct0g","MiKellner",2021-09-09 12:43:08,123,19
"1435927784367534083","Das sind schwerwiegende Vorwürfe, die schnelle Aufklärung brauchen. Alle Karten müssen schnellstmöglich und vor allem noch vor der Bundestagswahl auf den Tisch.
#Geldwäsche #Scholz https://t.co/0K0M9ADcyY","MiKellner",2021-09-09 11:27:16,368,63
"1435602442943619081","Der öffentlich-rechtliche Rundfunk ist ein Impfschutz für die Demokratie in unserem Land. Hier entgleist #Maaßen erneut. Die #Union muss sich endlich klar und deutlich von ihm abgrenzen. https://t.co/GgVJ9N4GOg","MiKellner",2021-09-08 13:54:29,380,54
"1435579717655175169","Unser Wahlprogramm ist jetzt auch in Gebärdensprache online. https://t.co/BpK16wi6Ns Danke an @EinAugenschmaus für die Vermittlung. Das ist ein tolles Projekt geworden. #Bundestagswahl","MiKellner",2021-09-08 12:24:11,680,144
"1435286433405837313","Recht hat er! Freue mich sehr, dass mit Frank #Bsirske eine starke Stimme aus den Gewerkschaften für uns kandidiert. #bereitweilihresseid https://t.co/HSiUYhSDj2","MiKellner",2021-09-07 16:58:46,143,13
"1435188526736347137","<U+0001F447><U+0001F44F><U+0001F3FC><U+0001F44F><U+0001F3FC><U+0001F44F><U+0001F3FC><U+0001F44F><U+0001F3FC> https://t.co/2qW68eC5wK","MiKellner",2021-09-07 10:29:43,173,14
"1435176856408498178","Klimaschutz ist die Menschheitsaufgabe unserer Zeit. Sie gehört ins Zentrum der nächsten Bundesregierung. #Bundestag #Bundestagswahl https://t.co/piYS1d2NH9","MiKellner",2021-09-07 09:43:21,63,3
"1434910710258147328","70 Prozent aller Lügen betreffen @ABaerbock - zu wenig tun Facebook und Co. dagegen und zu oft greifen Medien diese #Desinformationen auf #FakeNews #Wahlkampf https://t.co/01aEfu51hQ","MiKellner",2021-09-06 16:05:47,682,139
