"status_id","text","screen_name","created_at","favorite_count","retweet_count"
"1227612394756722688","der Vorsitzende der „Werte“Union unterstützte #AfD finanziell und spielte mit dem Gedanken beizutreten - entlarvend und zeigt die Motive von Mitsch, Maaßen &amp; Co! #noafd  https://t.co/otG5gF0Ccm","MiKellner",2020-02-12 15:16:17,189,49
"1227579069648297988","An alle geschichtsvergessenen in der CDU. Ihr habt eine eigene Geschichte in der DDR. #Thueringen https://t.co/Kyuu9XffOJ","MiKellner",2020-02-12 13:03:52,117,37
"1227286748943675392","Wir sehen im internationalen Kontext: da wo Demokratien wirklich ins Rutschen kommen, haben konservativen Parteien die Tore nach rechts aufgemacht. Die entscheidende Frage bleib: Wie halten es @cducsubt &amp; @fdpbt mit rechtsextremen Parteien wie der #noafd? https://t.co/gjji2HEXqT","MiKellner",2020-02-11 17:42:17,56,12
"1227255342913871872","eine gute Nachricht - Glückwunsch <U+0001F389> und Danke <U+0001F64F> Renate https://t.co/CsQlMdQi6m","MiKellner",2020-02-11 15:37:29,58,5
"1226821305657413632","Die CDU darf jetzt keinen Zweifel lassen, dass sie sich klar gegen die Rechtsextremen stellt und die Tore zur #AfD fest geschlossen hält. Zu viel Vertrauen in diese Selbstverständlichkeit wurde in den letzten Tagen zerstört. Persönlich alles Gute für Sie @akk #AKKRuecktritt","MiKellner",2020-02-10 10:52:47,190,23
"1226765259945521153","Die Führung der Union kämpft darum, ihre Partei auf Kurs zu halten. Die deutliche Reaktion der Unionsführung war richtig, doch dass sie darum mit Teilen ihrer Partei kämpfen muss, ist erschreckend. #Thueringen #noafd https://t.co/Q1uB2ZOzMZ","MiKellner",2020-02-10 07:10:04,74,16
"1226582170619215875","Finstere Abgründe in der CDU Sachsen-Anhalt. Dieser CDUler<U+0001F447> wollte schon 2019 „Das Soziale mit dem Nationalen versöhnen"". @PaulZiemiak sollte ihn rauswerfen. https://t.co/bATuZNzyRD","MiKellner",2020-02-09 19:02:32,139,18
"1226464639476752384","Gewalt, Hass und Hetze sind kein Mittel demokratischer Politik sein. Das muss unmissverständlich für alle gelten. “When they go low, we go high.“","MiKellner",2020-02-09 11:15:31,107,9
"1226427672462548992","Mit #Friedrich und #Kubicki hat der deutschen Bundestag übrigens zwei rechtsdurchdrehende Vizepräsidenten. Beide scheitern an der Aufgabe Demokratie vor Rechtsextremen zu verteidigen. #beschämend","MiKellner",2020-02-09 08:48:37,1003,159
"1226155838739566592","Notwendiger Schritt von #Kemmerich. Den nächsten Schritt muss jetzt die CDU Thüringen gehen, um das von ihr angerichtete Desaster zu begrenzen. Sie sollte im Landtag #Ramelow mittragen und muss aufhören #Linke mit #AfD gleichzusetzen.","MiKellner",2020-02-08 14:48:27,110,18
"1226105140056383493","Richtig so. Der Ostbeauftragte #Hirte muss gehen. Wer Zweifel an der Brandmauer nach Rechtsaußen lässt, darf kein Staatsamt bekleiden. Der nächste Ostbeauftragte sollte Bündnisse gegen Rechts statt Bündnisse mit Rechtsextremen schmieden.","MiKellner",2020-02-08 11:26:59,299,33
"1225795150728908801","#Kemmrich tritt nur scheibchenweise ab und #Lindner bleibt. Die #FDP trippelt auf der Stelle und scheut konsequente Schritte.","MiKellner",2020-02-07 14:55:12,152,16
"1225447427840278529","Die letzten 24 Stunden machen deutlich; wir müssen um unsere Demokratie kämpfen. Die Auseinandersetzung wird weitergehen. Hilf uns, verteidige mit uns unsere Demokratie, werde Mitglied. https://t.co/Bwhzo0Nkrt https://t.co/dAZTuFjEjS","MiKellner",2020-02-06 15:53:29,460,110
"1225421278573625344","Der überfällige Rücktritt von #Kemmerich kann nur ein erster Schritt sein. Thüringen braucht eine Regierung ohne rechtsextremen Einfluss. #Linder #Kubicki oder #Hirte haben sich zutiefst disqualifiziert und sind an der Aufgabe, unsere Demokratie zu verteidigen, gescheitert.","MiKellner",2020-02-06 14:09:34,257,39
"1225360929430392832","Was für ein Führungsversagen von #Lindner.
""Ich war mit Christian Lindner permanent in Kontakt."" Am Ende habe der Parteivorsitzende gesagt: ""Die Entscheidung trifft letztlich der Landesverband in Thüringen."""" https://t.co/dCjaBh2ii1","MiKellner",2020-02-06 10:09:46,130,16
"1225323448945332224","Gestern wie heute: #Kemmerich muss zurücktreten. Ansonsten ist die FDP Bündnispartner der Rechtsextremen.  #noAfd","MiKellner",2020-02-06 07:40:50,176,20
"1225140319240556544","#AKK #Söder &amp; @PaulZiemiak zeigen deutlich mehr demokratische Haltung als #Lindner. Das zeigt, wie weit rechts #Lindner die #FDP positioniert. #ThueringenWahl #Kemmerich https://t.co/VokLD13QbK","MiKellner",2020-02-05 19:33:08,145,16
"1225051661036675078","FDP #Ministerpräsident lässt sich durch Stimmen von Faschisten wählen, das ist ein Betrug am Wähler und ein Verrat an der Demokratie. #Thüringen #noAfD #AfD","MiKellner",2020-02-05 13:40:51,541,68
"1224991948559323136","Heute schauen Demokratinnen und Demokraten der Republik nach #Thueringen - @cdu_thueringen und @fdp_thueringen müssen zeigen, dass sie das Tor Richtung AfD geschlossen halten.","MiKellner",2020-02-05 09:43:34,38,2
"1224680025078816768","Das Spielchen um den Ausschluss von Fidesz aus der EVP ist eine unglaubliche Farce. Entweder es gibt ein Bekenntnis gegen Antisemitismus und zu den europäischen Werten oder eben nicht. CDU/CSU tolerieren den Bruch europäischer Werte. #Orban","MiKellner",2020-02-04 13:04:06,41,5
"1222925925022666752","Hass und Hetze gegen ehrenamtlich aktive Menschen nehmen zu. Deswegen finde ich den heutigen überparteilichen Austausch dazu wichtig und wertvoll. Ich wünsche mir ein zügiges Handeln der #GroKo und unterstütze dabei die Maßnahmen, die wirksam Hass und Hetze bekämpfen. https://t.co/BsykUCJJQh","MiKellner",2020-01-30 16:53:56,87,15
"1221755386191142913","Kein Vergessen. Nie wieder.
75 Jahre nach der Befreiung von Auschwitz ist das Erinnern an die Shoah so wichtig wie nie. Wir erleben wieder ein Erstarken des Antisemitismus und der rechtsextremer Gewalt. Das ist untragbar. #WeRemember https://t.co/6uE5zw6m2K","MiKellner",2020-01-27 11:22:37,88,6
"1221100142289477636","Kommt an Bord: https://t.co/84IZjW6xM5 https://t.co/KU7A2IkWrR","MiKellner",2020-01-25 15:58:55,65,8
"1221053632663126018","Irrsinn à la #GroKo 1,7 Mrd  Steuergeld faktisch ohne Gegenleistung der #Leag schenken, damit diese weiter Braunkohle verfeuert. Das ist kein Kohleausstieg. Das ist kein Klinaschutz. #LEAGGate #Kohlestoppen https://t.co/Mwxp7iKOLH","MiKellner",2020-01-25 12:54:06,87,21
"1220785947551375360","bitte folgen <U+0001F447> https://t.co/2CxRCKvMQQ","MiKellner",2020-01-24 19:10:25,24,3
"1220733183974694913","Damit es bald einen #Nachtzug Berlin-Brüssel-Paris gibt. Macht mit bei unserem Appell: https://t.co/CVHTVVwaPu https://t.co/nqdWsnn47o","MiKellner",2020-01-24 15:40:45,68,8
"1220267500698554369","bemerkenswert wie manche in den letzten 24 h zu Trump Fans werden, weil Robert #Habeck#Trump kritisiert - schade für alle Transatlantiker und Multilateralisten <U+0001F429> <U+0001F429> <U+0001F429>","MiKellner",2020-01-23 08:50:18,166,10
"1219565378248069120","Ich freu mich: @Anja_Piel ist eine ausgezeichnete Kandidatin für @dgb_news. Ihre Wahl wäre ein großer Gewinn für den DGB und ein herber Verlust für @gruenends. Und dieser Vorschlag zeigt, wie selbstverständlich Grüne und Gewerkschaften zusammenarbeiten.","MiKellner",2020-01-21 10:20:19,100,11
"1218936435811790849","Neujahresfrühstück bei @grueneKVpotsdam: wunderbar Mitglieder und alte Freunde zu ehren, die seit über 25 Jahren in der Partei sind. Dank BÜNDNIS 90 rückte die Frage von Menschenrechten, wer in unserer Gesellschaft repräsentiert ist und wer mitbestimmen darf in den Fokus. https://t.co/1uZa66ftZ4","MiKellner",2020-01-19 16:41:07,42,7
"1218803663277301760","#GroKo will #Hambi  plattmachen - unfassbare Planung durch #GroKo und  #RWE - #hambibleibt https://t.co/wEVaV21SMz","MiKellner",2020-01-19 07:53:32,53,15
"1218609758380404738","Tolle Konferenz von @GrueneBW zum Grundsatzprogramm! Die intensive Debatte innerhalb unserer Partei über „Die Werte, die uns einen“ ist ein wirklicher Luxus. Gerade in Zeiten, wo es viel zu oft nur um schnelle Reaktionen und verkürzte Zuspitzungen geht, ist das umso wichtiger. https://t.co/Fvd2cThMBQ","MiKellner",2020-01-18 19:03:01,58,2
"1218196046758719490","Jetzt bestellbar: unsere neue Chronik! Darin erzählen wir die Geschichte von Bündnis 90/Die Grünen, eingebettet in die deutsch-deutsche Geschichte. https://t.co/PRkglc8pNS https://t.co/naOtFkAjST","MiKellner",2020-01-17 15:39:05,58,9
"1217868436988223490","Heute waren Robert Habeck und ich zu Gast bei der Klausur vom @dgb_news . Mich freut es, dass unser Austausch eine Selbstverständlichkeit ist und wir zusammen eng an einem sozial-ökologischen Wandel arbeiten. https://t.co/EeV1vpTJek","MiKellner",2020-01-16 17:57:16,48,6
"1217707397726294016","Volle Solidarität Dir und Deinen Mitarbeiterinnen und Mitarbeitern. Wir stehen zusammen und verteidigen unsere Demokratie gegen Hass, Hetze und Gewalt. https://t.co/QWGgcDQTr7","MiKellner",2020-01-16 07:17:22,106,10
"1217046923590479873","Als Partei haben wir es geschafft zu einer neuen vertrauens- und respektvollen Diskussionskultur zu kommen. Nur als lernende Partei sind wir eine starke Partei. Dieser Anspruch wurde jedoch laufend durch Indiskretionen zerstört. So können und wollen wir nicht diskutieren. https://t.co/diWSDXpHK1","MiKellner",2020-01-14 11:32:52,94,6
"1216668792052486150","Heute vor genau 40 Jahren wurden die Grünen in Karlsruhe gegründet. Wir feiern weiter. <U+0001F973> <U+0001F680> #40JahrGrüne #30JahreBündnis https://t.co/VrAVGxFf0v","MiKellner",2020-01-13 10:30:19,110,12
"1216381993644175374","Wunderbarer Neujahrsempfang heute in #Kleve - im Museum Kurhaus. Ich hatte sogar noch Zeit das Museum und Kunstwerke von Joseph Beuys, dem wir u.a. unsere Sonnenblume verdanken, zu besichtigen. Tolle Menschen, tolles Museum, tolle Veranstaltung! https://t.co/9VfmFpNjcN","MiKellner",2020-01-12 15:30:41,32,1
"1215967297610964992","Voll fit nach der Party. Gemeinsam bei unseren tollen Sprecherinnen und Sprechern der Bundesarbeitsgemeinschaften. https://t.co/8kj4k4gX2g","MiKellner",2020-01-11 12:02:49,98,3
"1215724442053234693","""Ihre Geschichte ist ein Beleg für die Zukunftsfähigkeit der Demokratie."" Welch starke und nach vorne gerichtete Worte von Frank-Walter Steinmeier.","MiKellner",2020-01-10 19:57:48,62,6
"1215667087156314112","Zeiten ändern sich. Wir ändern sie mit. Gleich startet unsere große Geburtstagsparty. 40 Jahre die Grünen. 30 Jahre Bündnis 90. https://t.co/OXPKSp0E6z","MiKellner",2020-01-10 16:09:54,112,11
"1215603419651637248","Mein Geburstagswunsch für @Die_Gruenen : jetzt für die nächsten 40 Jahre Mitglied werden https://t.co/qA2hAPjJCR","MiKellner",2020-01-10 11:56:54,119,23
"1215558110951235585","#40JahreGrüne #30JahreBündnis https://t.co/Grtn1dlR5n","MiKellner",2020-01-10 08:56:52,14,1
"1215263239912787968","<U+0001F528> https://t.co/Z3NHX1Ox6I","MiKellner",2020-01-09 13:25:09,37,4
"1215260962065977344","Protokoll BuPrä trifft Grün, freu mich auf die Feier <U+0001F389> <U+0001F973> <U+0001F37E> #40JahreGrüne #30JahreBündnis https://t.co/48K0y8Ab9d","MiKellner",2020-01-09 13:16:06,93,4
"1214894212723949568","aktuell in unserer Poststelle - Eintrittswelle hält an. Macht einfach gute Laune. https://t.co/f2ztd8BWhn https://t.co/ke2XaLbHHq","MiKellner",2020-01-08 12:58:46,300,39
"1214573038102036480","Mit diesem Stimmzettel wurden vor 40 Jahren die Grünen gegründet. Er hat einen Ehrenplatz bei mir im Büro. Danke an Klaus Adler für dieses besondere Dokument. https://t.co/FLyXBPcJ5I","MiKellner",2020-01-07 15:42:32,135,7
"1214165678007234560","Auftakt - Vorstandsklausur im schönen Hamburg - freu mich auf die Wahlkämpfe und die Arbeit am neuen Grundsatzprogramm #TeamFegebank #neueZeitenneueAntworten https://t.co/LbBJc1NcS2","MiKellner",2020-01-06 12:43:50,57,3
"1213805877599363072","Was für eine traurige Geschichte - die #CSU steckt so tief im Gestern fest.   https://t.co/PmgBn5f8tr","MiKellner",2020-01-05 12:54:07,120,11
"1209385314420170752","In Gedanken an Rudi #Dutschke, der heute vor 40 Jahren an den Spätfolgen eines Mordanschlags starb. Mitgründer der Grünen &amp; mit seiner ostdt. Biografie hat er, nicht nur Anfang der 90er, der gesamten Linken schmerzhaft gefehlt. https://t.co/XGEdAtCfg2","MiKellner",2019-12-24 08:08:22,349,79
"1209235304416251906","Nachtrag: Auch die katholische Kirche hat sich dankenswerterweise klar geäußert https://t.co/XCHAhMXG2r #Habeck #Griechenland #Flucht #Kinder https://t.co/WbfAxdOo7j","MiKellner",2019-12-23 22:12:17,102,18
"1209035276938612736","Solidarität und Menschlichkeit: Flüchtlingskindern helfen. #Habeck Danke für die klaren Worte an Heinrich Bedford-Strohm: ""Zeit, humanitäre Zeichen zu setzen“ https://t.co/BzO2AW0lRI","MiKellner",2019-12-23 08:57:27,177,25
"1207332162531418112","kleiner Lesetipp für alle, die von Politik nicht genug bekommen, hat meine langen Zugfahrten erhellt und vor allem aufgeheitert https://t.co/2Sqmg9KIo5","MiKellner",2019-12-18 16:09:53,23,2
"1207317724696850433","Soziales &amp; Ökologie gehen Hand in Hand! Heute ist Dr. Timm, Geschäftsführer der @bagfw, bei uns Mitglied geworden. Das freut mich enorm! Ich danke ihm für einen spannenden Austausch und freue mich über die vielen Überschneidungen! @TimmWeb https://t.co/rXnPCVvAD4","MiKellner",2019-12-18 15:12:31,50,2
"1206891174956548101","Auf unseren Feldern und Wiesern verschwinden Kiebitz und Rebhuhn in ungeheurer Geschwindigkeit. Um das zu stoppen brauchen wir eine andere Landwirtschaft. Damit Landwirte wieder Verbündete im Naturschutz sein können und nicht zur Zerstörung gezwungen werden. https://t.co/4J1eBEbqOk","MiKellner",2019-12-17 10:57:33,12,4
"1206633241878380544","Happy Birthday @gruenenrw <U+0001F33B><U+0001F389><U+0001F44D><U+0001F3FF> https://t.co/srTAltiiRc","MiKellner",2019-12-16 17:52:37,61,6
"1206336931380047872","Bitter. Madrid scheitert. Das ist kurzsichtig, egoistisch gegenüber künftigen Generationen und verantwortungslos. Jetzt #Klimaschutz von unten über die Kommunen. #Cop25Madrid2019","MiKellner",2019-12-15 22:15:11,360,47
"1206190090663399424","Dass ich mal als Thüringer eine Festrede bei 40 Jahre @gruenehessen  halten würde, hätte ich auch nie gedacht. https://t.co/yBawDyZSH4","MiKellner",2019-12-15 12:31:42,38,4
"1206174051984707584","Herzlichen Glückwunsch @gruenehessen - hier “Zum Löwen” wurde vor 40 Jahren der Landesverband gegründet https://t.co/PWL7rjcWh2","MiKellner",2019-12-15 11:27:58,42,3
"1205593096601378816","Wenn die <U+2066>@cdulsa<U+2069> demokratischen Anstand hat, dann versucht sie ihren Nazifunktionär loszuwerden. #cdu  https://t.co/zNi5W44uir","MiKellner",2019-12-13 20:59:27,95,21
"1205425044140244996","Passendes Bild im heutigen @szmagazin Johnson zertrümmert das Vereinigte Königreich. #UKelection2019 https://t.co/tShVMqqM4z","MiKellner",2019-12-13 09:51:40,8,1
"1204443758944833537",".@KwongGlacier, @joshuawongcf und ihre Mitstreiter*innen kämpfen jeden Tag für den #TagDerMenschenrechte. Wir stehen hinter ihnen, denn das grundlegende Versprechen der Menschheit von Freiheit und Würde des Einzelnen muss überall gelten. #StandWithHongKong","MiKellner",2019-12-10 16:52:24,18,0
"1203957384521105410","Die CDU Sachsen-Anhalt robbt weiter Richtung #AfD <U+0001F447> - die #CDU auf Bundesebene sollte von ihrem Landesverband klare Haltung einfordern# https://t.co/8PbBuSg6tX","MiKellner",2019-12-09 08:39:43,22,4
"1203641282045849605","Wer meint Politik durch Malen nach Zahlen ersetzen zu können, sollte sich einfach mal diese beiden Umfragen <U+0001F447>anschauen. #Zahlensalat https://t.co/F4scnJJDS9","MiKellner",2019-12-08 11:43:38,47,8
"1203418961582469121","heute mit @gruenekassel 40 Jahre Grüne gefeiert - wunderbarer Abend https://t.co/SGRFNYNVPq","MiKellner",2019-12-07 21:00:13,25,2
"1202657253557460993","#Ehrenamt heißt morgens vor der Arbeit Flyer zu verteilen, nach der Arbeit auf Sitzungen sein, sich mit anderen zusammen tun und etwas bewegen und am Wochenende für die Gemeinschaft einstehen. Danke für dieses Engagement! Das ist das Rückgrat unserer Gesellschaft.","MiKellner",2019-12-05 18:33:28,101,11
"1202536355844296705","Wir haben gerade einen starken Parteitag hinter uns und alle aktuellen Personalfrage mit riesiger Unterstützung geklärt. Weitere Personalfragen entscheiden wir, wenn sie anstehen. https://t.co/K40FCTOCnN","MiKellner",2019-12-05 10:33:03,55,4
"1201797476379959297","Wir brauchen Reformen des Parteiengesetzes, damit Parteien die Möglichkeiten von Digitalisierung und Online-Beteiligung besser nutzen können. https://t.co/Umgc57ULD7","MiKellner",2019-12-03 09:37:01,24,5
"1201092209669529600","Wir sind jetzt 95.000 Grüne. Helft mit 100.000 zu werden. https://t.co/84IZjW6xM5 https://t.co/7Vr9lAUu6Q","MiKellner",2019-12-01 10:54:32,519,138
"1200763156529856512","Herzlichen Glückwunsch an @SusanSziborra und @StriegSe - ich freue mich über einen tolles Team für  @GRUENE_LSA https://t.co/IYUWde0qvJ","MiKellner",2019-11-30 13:07:00,38,5
"1200400562044452865","Von wegen der Protest flaut ab. Hier sind wieder tausende, die endlich richtigen Klimaschutz fordern. #NeustartKlima #FridaysForFuture #Klimastreik https://t.co/tlOCrpDwFN","MiKellner",2019-11-29 13:06:11,185,24
"1200110890936340480","Wir gestalten die ökologisch-soziale Marktwirtschaft zusammen

Herzlichen Dank an die Spitze von @dgb_news , @_verdi, @igbce und @gew_bund für den Besuch in Bielefeld. So geht Bündnispartei. https://t.co/u3B26y5ujY","MiKellner",2019-11-28 17:55:08,177,43
"1198952010504114176","Demokratie braucht Bündnisfähigkeit und über das Parteiensystem in Ostdeutschland. Mein Gastbeitrag in der FAZ. (Leider hinter der Paywall) https://t.co/fmoVWZE3Mn","MiKellner",2019-11-25 13:10:09,3,1
"1198544335366709248","Wir erinnern an unsere Wurzeln. Heute vor 30 Jahren wurde die Grüne Partei in der DDR gegründet und morgen feiern wir dieses Jubiläum ab 17 Uhr in der Berliner Bekenntniskirche, Plesserstraße 4. https://t.co/BYuFSHwY1y","MiKellner",2019-11-24 10:10:12,138,35
"1196893451423567873","kluge, kontroverse und nachdenkliche Debatte zum Grünen #Grundsatzprogramm mit @gruenemitte #neueZeitenneueAntworten https://t.co/Wn3TOWo9fz","MiKellner",2019-11-19 20:50:10,38,4
"1196118217669971968","Herzlichen Dank für eine großartige #bdk19. Das war die neunte Parteitag, für die ich als PolGF verantwortlich war. Ich glaube, noch nie bin ich mit so einem rundum gelungenen Gefühl zurück gefahren. Ich freue mich mit diesen Beschlüsse in eine Bundestagswahl zu ziehen. <U+0001F64F><U+0001F33B>","MiKellner",2019-11-17 17:29:40,211,14
"1196041282134708226","Parteitag beschließt 12 € Mindestlohn. Denn das Versprechen des Mindestlohn war: Wer arbeitet soll nicht arm sein. Es wird jeden Tag gebrochen. Deshalb wollen wir einen Mindestlohn von 12€. #bdk19","MiKellner",2019-11-17 12:23:57,1042,93
"1195704759702949888","Ich bin überwältigt. Danke für eure Stimmen. 
Jetzt will ich mit euch dafür kämpfen, dass der Wille nach Veränderung in politische Macht umgesetzt wird. #bdk19","MiKellner",2019-11-16 14:06:44,387,10
"1195704547798343680","Ich erlebe doch allerorten, du musst nicht reich sein, du musst nicht Wessi sein,
du musst nicht in der Großstadt leben um zu wissen, dass Umweltschutz Voraussetzung für eine lebenswerte Zukunft ist. #bdk19 https://t.co/p7U8Xo4hdo","MiKellner",2019-11-16 14:05:53,89,5
"1195630593696043008","Ich werde Gesine im Vorstand vermissen. #bdk19 https://t.co/8GwFEIhtPT","MiKellner",2019-11-16 09:12:01,84,2
"1195429382774497280","Für ein Recht auf Wohnen! Wohnen ist eine der großen sozialen Fragen dieser Zeit. Wir zeigen, dass Klimaschutz und sozialer Zusammenhalt zusammengehen. #bdk19 https://t.co/Qx7okNoR2T","MiKellner",2019-11-15 19:52:29,63,11
"1195364182285324289","Hanni Lévy war vor zwei Jahren auf unserer BDK. Sie hat uns eindrücklich mitgegeben, worauf es in diesen Zeiten ankommt. Die letzten Zeitzeugen sterben. Es ist unsere Aufgabe den Kampf gegen Antisemitismus und Rassismus gemeinsam mit allen Demokrat*innen zu führen. #bdk19 https://t.co/ilusvE2XPK","MiKellner",2019-11-15 15:33:24,142,36
"1193591093956403200","Wahnsinn. Wir gewinnen #Hannover. Hannover! Herzlichen Glückwunsch an @BelitOnay @gruenehannover und @gruenends","MiKellner",2019-11-10 18:07:47,216,15
"1190638146716872704","lebendige Partei - gute Debatte mit den tollen Sprecher*innen der Bundesarbeitsgemeinschaften, wie wir unser Parteiwachstum gestalten https://t.co/A1FrEkVrvl","MiKellner",2019-11-02 14:33:49,17,1
"1190185550793322496","sehr lesenswert <U+0001F44D> https://t.co/JgJJ2oNYF8","MiKellner",2019-11-01 08:35:22,10,0
"1189608683908599813","Antragskommission im BDK-Fieber. <U+0001F912> Bis bald in Bielefeld #bdk19 https://t.co/qqrcS7m7ov","MiKellner",2019-10-30 18:23:06,76,9
"1189212674548215808","Bei @Die_Gruenen wird online fleißig diskutiert. Zur Diskussion über das neue Grundsatzprogramm gibt es schon wieder 11 erfolgreiche Mitgliederbegehren an den Bundesvorstand. So geht #digitale Partei. <U+0001F449> https://t.co/gfzpim099A","MiKellner",2019-10-29 16:09:30,49,5
"1187990672369999872","Ich war unterwegs, um @Gruene_TH zu unterstützen. Dabei habe ich wunderbare Menschen getroffen, die #Thüringen weiter verändern wollen. Dafür: Zweitstimme GRÜN.<U+0001F33B><U+0001F49A>
#hierjetztmorgen #aufgrünkommtesan #grünersonntag #ltwth19 https://t.co/pxdwIECYDO","MiKellner",2019-10-26 07:13:42,62,5
"1187697750068137990","Mit Sonnenblumen von Tür zu Tür. #ltwth19 https://t.co/NMjRM3DcfC","MiKellner",2019-10-25 11:49:44,48,0
"1187051109086650371","Der unglaublich bewegende Auftritt von Hanni Levy wird mir immer in Erinnerung bleiben. Der Vorschlag sie einzuladen kam damals von Claudia Roth. https://t.co/0VitqUwopx","MiKellner",2019-10-23 17:00:13,102,15
"1186674871142682630","heute im Röntgenmuseum(!) grüne Debatte zum Grundsatzprogramm mit @GrueneRS #WenndasUliSchultewüsste #Eilmeldung https://t.co/ZCXVBdyaNV","MiKellner",2019-10-22 16:05:11,8,0
"1186212330247467010","Es braucht eine Reform des Gemeinnützigkeitsrechts um politisches Engagement abzusichern https://t.co/q72B8sTFpN","MiKellner",2019-10-21 09:27:12,184,36
"1185999780855648257","Glückwunsch @GrueneCH - was für ein großartiges Ergebnis @RegulaRytz https://t.co/56hnSpQrff","MiKellner",2019-10-20 19:22:37,62,7
"1185465892160835586","Die #CDU hat keine realistische Machtoption. Eine Stimme für Mike Mohring bringt #Thüringen nur Regierungschaos näher. Deswegen starke Grüne für eine starke Regierung. #Demokratie #Klimaschutz #ltwth19","MiKellner",2019-10-19 08:01:08,307,49
"1184833243293597697","Grüne sind Eurovision-Sieger der Parteien. Die Ergebnisse der europaweiten Pew-Studie sind ein riesiger Vertrauensvorschuss. 63% haben in Deutschland ein positives Bild von @Die_Gruenen. Das ist ein Ansporn für echte Veränderung zu kämpfen - ökologisch, gerecht und demokratisch. https://t.co/bnGWHFgM9F","MiKellner",2019-10-17 14:07:12,338,65
"1183361267425263620","#Unteilbar für Menschenrechte und gegen Rassismus und Antisemitismus. Gemeinsam setzen wir dafür ein Zeichen auf dem Bebelplatz, dort wo die Nazis Bücher verbrannt haben. #KeinFussbreit https://t.co/G4CBGyhaeN","MiKellner",2019-10-13 12:38:06,91,7
"1182683394880294912","Wir zeigen am Sonntag zusammen mit @Unteilbar_ und der @JFDA_eV: Wir stehen zusammen gegen Antisemitismus und Rassismus. Ich bin am Sonntag, um 13 Uhr, am Bebelplatz. Kommt bitte zahlreich. #unteilbar https://t.co/l78bWni5AG","MiKellner",2019-10-11 15:44:29,66,25
"1181236420863778816","Die Bundesregierung schwächt ihr Klimapaket auch noch ab. Ich kann es kaum fassen. Hier sind unsere radikal realistischen Maßnahmen für echten #Klimaschutz: https://t.co/M0aLyPfyMW https://t.co/eh7taCZTS4 https://t.co/AxmRMSQzhZ","MiKellner",2019-10-07 15:54:43,51,12
"1181112377179332610","für die friedliche Revolution vor 30 Jahren war nicht nur Leipzig, sondern auch #Plauen von entscheidender Bedeutung. Danke Plauen<U+0001F64F> https://t.co/cPIiRIPhre","MiKellner",2019-10-07 07:41:49,35,2
"1180761004403253248","Würde die #SPD genauso viel Energie für #Klimaschutz verwenden, wie für Beschimpfung der Konkurrenz, dann ginge es dem Klima besser. Liebe @SPD, den Klimawandel hinzunehmen ist das Gegenteil einer sozialen Politik. https://t.co/0t2AXXL3yT","MiKellner",2019-10-06 08:25:35,403,70
"1180176148866699267","mit klarem sozialen Profil - unserer Antrag für #bdk19 - 12 € Mindestlohn, Tarifverträge leichter allgemeinverbindlich erklären &amp; öffentliche Vergabe an Tarifvertrag binden https://t.co/oKF5mnSamp","MiKellner",2019-10-04 17:41:35,55,6
"1179693401891049472","#TagderDeutschenEinheit hat mir große Freiheiten und Möglichkeiten gebracht. Ohne die deutsche Einheit würde ich heute nicht meine Familie in Bonn treffen.","MiKellner",2019-10-03 09:43:19,31,0
"1179417672053862400","Ich bin gerne bereit, unsere Vorschläge ins Konrad-Adenauer-Haus zu schicken, von mir aus auch per Fax. #AKK #NotMyKlimapaket  https://t.co/EfCZ40HhR0","MiKellner",2019-10-02 15:27:40,716,141
"1179118590815080448","freue mich morgen auf @gruenelev heute @B90GrueneNeuss hat mir viel Freude gemacht (mit schon herbstlicher Deko) https://t.co/R5lYi2S3DO https://t.co/bLndHXe5YY","MiKellner",2019-10-01 19:39:13,9,0
"1178992825641381888","Pressesaal mal anders - vor genau 20 Jahren ist die grüne Parteizentrale von Bonn nach Berlin gezogen. Heute feiern wir dieses Jubiläum mit dem tollen Team der Geschäftsstelle. https://t.co/7cVYSAt44h","MiKellner",2019-10-01 11:19:28,55,3
"1178326569535901697","Die @Gruene_Austria sind fulminant zurück, das zeigen die erste Hochrechnungen. Großartig &amp; herzlichen Glückwunsch @WKogler @lgewessler https://t.co/SzkPCJA2sO","MiKellner",2019-09-29 15:12:01,151,11
