"status_id","text","screen_name","created_at","favorite_count","retweet_count"
"1339198915913068546","Über eine halbe Million Uiguren verrichten in China Zwangsarbeit. Das sind ungeheure Menschenrechtsverletzungen.
Für Europa heißt das: Lieferketten müssen transparenter werden. Es braucht ein #Lieferkettengesetz mit einem Signal für eine europäische Lösung https://t.co/D0maJ29ff5","MiKellner",2020-12-16 13:21:17,100,17
"1338887617098682370","Das kann ja eigentlich nur ein schlechter Scherz sein. In der #CDU wird ernsthaft diskutiert, den öffentlich-rechtlichen Rundfunk zu privatisieren. https://t.co/TumEy5BDI7","MiKellner",2020-12-15 16:44:17,414,58
"1338533472328159235","Vor knapp vier Monaten hat das Lager #Moria gebrannt. An dem Elend hat sich nichts geändert. Die Bewohnerinnen und Bewohner müssen sofort evakuiert werden. #KaraTepe https://t.co/1hkKtRwoKH","MiKellner",2020-12-14 17:17:03,90,14
"1338516099260952576","Umweltministerin Schulze sieht keine Notwendigkeit für ein höheres deutsches Klimaziel, obwohl die EU ihr eigenes Ziel massiv verschärft. Entsprechend ambitionslos ist die Einigung der #GroKo zum #EEG. #PolitikDesVertagens - die Klimakrise wartet nicht.
https://t.co/VYvMjiDZNt","MiKellner",2020-12-14 16:08:01,14,4
"1338415017272741889","Gerade auch in der Krise muss jede und jeder von ihrer Arbeit leben können. Volle Unterstützung deshalb für @dgb_news und @_verdi und die Forderung den #Mindestlohns auf 12€ zu erhöhen. Es braucht einen armutsfesten Mindestlohn.","MiKellner",2020-12-14 09:26:21,121,11
"1337507546790293504","Jetzt entschieden handeln #Covid19 #Pandemie https://t.co/Npi4VOYfbk","MiKellner",2020-12-11 21:20:23,9,0
"1336950616590082050","Der interne Wahlkampf der Union wird jetzt auf den Rücken der Schwächsten geführt. Keine Abschiebungen in das Bürgerkriegsland Syrien. #Röttgen","MiKellner",2020-12-10 08:27:20,292,32
"1336631299373748226","Macht mit, indem ihr diesen Beitrag teilt und schreibt den Inhaftierten Weihnachtskarten. #FreeChineseHostages https://t.co/9B9RlI7Ye9","MiKellner",2020-12-09 11:18:29,13,4
"1336271047335825409","Der Putschversuch der Stahlknechte ist vorerst gescheitert und damit die CDU in eine Minderheitsregierung, toleriert von der AfD, zu treiben. Medienpolitisch ist es ein Desaster. Die CDU hat keinen klaren Kompass und keine Führung. In #SachsenAnhalt ist sie offen nach rechts.","MiKellner",2020-12-08 11:26:59,208,20
"1336256122819325952","Richtige Haltung @GRUENE_LSA  <U+0001F64F> für euren Einsatz angesichts einer desaströsen CDU. Medienpolitisch sind es furchtbare Wochen. https://t.co/3m72E5siRf","MiKellner",2020-12-08 10:27:40,91,8
"1335633675459956743","Bei der Debatte um den Rundfunkstaatsvertrag geht es längst nicht mehr um Sachfragen. Jetzt geht es auch darum, ob sich die CDU vom Konsens der Demokraten - keine Zusammenarbeit mit Verfassungsfeinden - abwendet. Meine Antwort auf den Beitrag von @PaulZiemiak #Rundfunkbeitrag https://t.co/SozkyNAvfq","MiKellner",2020-12-06 17:14:17,40,4
"1335599230933757954","Vor genau 30 Jahren starb Amadeu Antonio an seinen Verletzungen durch einen Überfall von Neonazis. Der Mord mahnt uns gegen Rassismus zu wirken und für eine gleichberechtigte Gesellschaft der Vielen einzutreten. #AmadeuAntonio @Vogel_Axel https://t.co/BZc8GOZFV2","MiKellner",2020-12-06 14:57:25,94,19
"1335162642718199813","Wasserwerfer im Dezember (!) gegen friedlichen zivilen Ungehorsam ist eine unnötige Eskalation und gefährlich für die Demonstrant*innen. https://t.co/jUGx9ezSLP","MiKellner",2020-12-05 10:02:34,569,80
"1335154533601849344","#Rundfunkbeitrag Die Anpassung von 86 Cent liegt unterhalb des Inflationsausgleichs. Der Beitrag bleibt stabil. #Kenia hat Beitragsstabilität vereinbart, kein einfrieren des Beitrags. Alle, die SPD und Grünen ein Abweichen vom KoaVertrag vorwerfen, missverstehen diesen bewusst.","MiKellner",2020-12-05 09:30:21,443,61
"1334924377503264769","Dieser Text von @PaulZimiak ist der ausformulierte Freifahrtschein für einen harten Rechtsschwenk der CDU-Landesverbände. <U+0001F447> https://t.co/l8cHTORZzE","MiKellner",2020-12-04 18:15:47,319,33
"1334898236998475779","Die europäische Idee beruht auf Rechtsstaatlichkeit und Demokratie. Deshalb darf es beim Rechtsstaatsmechanismus keinen Freifahrtschein geben. Ungarn und Polen dürfen mit ihrem Blockadeversuch nicht durchkommen. #DontGiveIn","MiKellner",2020-12-04 16:31:55,185,21
"1334875901507604484","Amadeu Antonio wurde vor 30 Jahren von Neonazis auf offener Straße in Eberswalde ermordet. Wir dürfen niemals wegsehen, sondern aktiv gegen Rassismus arbeiten. Ich bin dankbar, dass die @AmadeuAntonio Stiftung sein Andenken mit ihrer wichtigen Arbeit würdigt. https://t.co/cnDjQTo3R6","MiKellner",2020-12-04 15:03:10,148,8
"1334392925749436421","Die Bundesebene der #CDU muss diese Woche nutzen, um ihren Landesverband davon zu  überzeugen, dass die CDU an Seite der demokratischen Kräfte, nicht an der der #AfD. #Rundfunkbeitrag https://t.co/DvFIIvRMRv","MiKellner",2020-12-03 07:03:59,52,7
"1334209164185317378","Friedrich #Merz hat kein Problem damit, wenn die #CDU in Sachsen-Anhalt mit der AfD den öffentlich-rechtlichen Rundfunk angreift und nach rechts umkippt. Wir #Grüne schon. Was sagen eigentlich #Laschet #Röttgen und #AKK dazu? #Rundfunkstaatsvertrag   https://t.co/X5rZXgjjIp","MiKellner",2020-12-02 18:53:47,98,9
"1334090206924988416","Freiheit für @JoshuaWong. Sein Mut erinnert mich an die Bürgerrechtsbewegung von 1989. Das Urteil gegen #JoshuaWong muss Auswirkungen auf das EU-China Investitionsabkommen haben. Die Bundesregierung ist gefordert endlich Druck zu machen. #StandWithHongKong #FreeThemAll","MiKellner",2020-12-02 11:01:06,98,16
"1333833736409018371","In 300 Tagen ist die Bundestagswahl. Dann entscheidet sich wie das kommende Jahrzehnt in Deutschland und Europa geprägt sein wird. Mach mit und werde jetzt Mitglied. Mit dir wird das kommende Jahrzehnt eins des Aufbruchs, der Ökologie, des Zusammenhalts und der Vielfalt. https://t.co/DrIdLK4oq1","MiKellner",2020-12-01 18:01:58,186,35
"1333786064893349891","Was für starke Rednerinnen bei der Gedenkstunde für die Opfer des Nationalsozialismus im Bundestag. Solidarität mit @Cha_Knobloch und @Afelia https://t.co/ClRswsZQqe","MiKellner",2020-12-01 14:52:33,28,3
"1333687240296443904","„Wenn die #CDU in so einer zentralen demokratischen Frage lieber mit den Verfassungsfeinden von der #AfD gemeinsame Sache macht, statt den Öffentlich-Rechtlichen Rundfunk zu stärken, dann verlässt die Union die Geschäftsgrundlage der Kenia-Koalition.#SachsenAnhalt https://t.co/dUhUSWBCkk","MiKellner",2020-12-01 08:19:51,93,12
"1331562598878355460","Es ist wichtig in den nächsten Wochen nach Sachsen-Anhalt zu schauen. Wird die CDU Sachsen-Anhalt mit der #AfD gegen die eigene Regierung stimmen? #Rundfunkstaatsvertrag https://t.co/osifxgNrsf","MiKellner",2020-11-25 11:37:17,86,20
"1331313019897438209","Solidarität mit Joshua #Wong! Die Bundesregierung muss jetzt Handeln, um die zu schützen, die sich für die Demokratie in Honkong einsetzen. Deshalb sollte sie jetzt das Auslieferungsabkommen und das Rechtshilfeabkommen mit Hongkong aufkündigen. https://t.co/nYaHgxyFqj","MiKellner",2020-11-24 19:05:33,188,26
"1331238829831954432","Das ist grandios! Wir haben ein Grundsatzprogramm für die nächsten 20 Jahre beschlossen. Hier findet ihr den vorläufigen Beschluss. Viel Spaß beim Lesen!
https://t.co/XElSBlBsY8","MiKellner",2020-11-24 14:10:44,118,18
"1330547855157833729","Danke! Das war ein geile #dbdk20,  mit allem was dazugehört. Ich bin Sack glücklich über das neue Grundsatzprogramm, das wir fast 3 Jahre mit unzähligen Menschen diskutiert und 831 Delegierten abgestimmt haben. Über 100.000 von euch waren am Wochenende im Stream dabei. https://t.co/oDswB0H9RC","MiKellner",2020-11-22 16:25:03,291,38
"1330493000858947590","Volksentscheide waren eine spannende und knappe Debatte. Hätte mir einen anderen Ausgang gewünscht. Ich freue mich, dass wir mit Bürgerräten, die durch die Bevölkerung eingesetzt werden sollen, trotzdem ein starkes Signal für mehr Beteiligung senden. #dbdk20 https://t.co/sQfq7hDTF2","MiKellner",2020-11-22 12:47:05,29,0
"1330283959285133323","Die Technik war schneller müde, als ihr und wir hier im Tempodrom. Wir werden die Debatte morgen, um 10 Uhr, fortsetzen. Jetzt gehts weiter mit der Party, die habt ihr euch verdient. Die höchste Eisenbahn auf https://t.co/GdkSFjVpEv #dbdk20","MiKellner",2020-11-21 22:56:26,133,7
"1330257320702582794","Was Britta sagt <U+0001F49A><U+0001F447> und herzlichen Applaus auch an alle Delegierten und Ersatzdelegierten für Eure Energie https://t.co/GxC73rdSbc","MiKellner",2020-11-21 21:10:34,53,1
"1330230669981716480","#Servicetweet #Presse #dbdk20 https://t.co/aw752JPkU2","MiKellner",2020-11-21 19:24:40,111,2
"1330207753080627207","Großartig. Der nächste Schritt in unserer Parteientwicklung. #Danke für die überwältigende Zustimmung. #Vielfalt #Statut #dbdk20 https://t.co/3lHklvbWmD","MiKellner",2020-11-21 17:53:37,76,4
"1330097214002253824","sehr gute Einigung <U+0001F44C> Klima #ParisAgreement #dbk20 https://t.co/5TdafzTJCh","MiKellner",2020-11-21 10:34:22,34,0
"1329872628581068803","Es bedeutet eine Überforderung des Einzelnen, wenn einzig und allein die eigenen Konsumentscheidungen die Welt retten sollen. Es ist deshalb Aufgabe von Politik, gute Regeln zu setzen. #dbdk20","MiKellner",2020-11-20 19:41:57,1111,124
"1329870911437234177","Das ist der Weg. Genauso ist es. #dbk20 https://t.co/PXFNsFYM2S","MiKellner",2020-11-20 19:35:07,17,2
"1329856754079977477","<U+0001F923><U+0001F923><U+0001F923><U+0001F923> Was wäre eure Saalwette? https://t.co/46Govstwpa","MiKellner",2020-11-20 18:38:52,35,1
"1329832795674382339","Jede Zeit hat auch die Momente, in denen aus tausendfacher Erfahrung, aus einem überwältigendem Wissenschatz, und aus so vielen mit Herzblut geführten Diskussionen politische Wirklichkeit entsteht. So ein Moment ist jetzt. So ein Moment wird dieses Wochenende. #dbdk20 https://t.co/2yMPhGChQF","MiKellner",2020-11-20 17:03:40,177,13
"1329456415094747137","Voller Vorfreude auf morgen. #dbdk20 https://t.co/7lXRdyTJe9","MiKellner",2020-11-19 16:08:04,122,4
"1328968264773496832","So ist es<U+0001F447> Unser Land braucht Veränderung. #dbdk20 https://t.co/mmp4LmqpPv","MiKellner",2020-11-18 07:48:20,43,5
"1328454076124819457","Die EVP sollte sich endlich von #Orban trennen. https://t.co/A2aSZYSkor","MiKellner",2020-11-16 21:45:07,135,8
"1328091306288148482","Macker #Merz gegen die kluge und sympathische @abaerbock - das war #AnneWill.","MiKellner",2020-11-15 21:43:36,394,9
"1328084905415372801","Friedrich #Merz tritt wie der Cheflobbyist  von #Blackrock auf. #AnneWill https://t.co/2utUbKfzQO","MiKellner",2020-11-15 21:18:10,65,2
"1328082022682726400","starkes Plädoyer von @ABaerbock für nachhaltige Investitionen in Klimaschutz statt Geld ohne scharfe Klimaauflagen an #Lufthansa zu geben. #AnneWill","MiKellner",2020-11-15 21:06:43,352,21
"1327169735042207744","Noch eine Woche bis zur #dbdk20 auf der wir unser neues Grundsatzprogramm beschließen.
#neueZeitenneueAntworten https://t.co/YL7tt08UHG","MiKellner",2020-11-13 08:41:37,47,5
"1326871947117010949","<U+0001F447>Das sagt ausgerechnet eine Partei, die sich zwei Jahre mit Personalquerelen beschäftigte. Obskure Personalspekulationen abzuleiten, weil sich Robert Habeck intensiv um dieses wichtige Thema kümmert, sind Banane. https://t.co/UPM1U9UfHS","MiKellner",2020-11-12 12:58:18,262,10
"1325734231675465730","Der #9November erinnert an viele Facetten der deutschen Geschichte. Der Tag lehrt: #Freiheit und #Demokratie sind nicht selbstverständlich. Sie müssen immer wieder neu erstritten und #Antisemitismus entschieden begegnet werden. https://t.co/Fcy0AajSuN","MiKellner",2020-11-09 09:37:26,60,9
"1325508475691143169","Fetten Glückwunsch nach Göppingen @allworldisgreen gewinnt die Stichwahl <U+0001F973> #Fotofinish","MiKellner",2020-11-08 18:40:22,80,5
"1325374417728319488","In Sachsen hat erneut Polizei und Polizeiführung bei der Verteidigung des Rechtsstaats versagt. Es bedarf einer dringenden Aufklärung und Konsequenzen. https://t.co/uVEmO3zkHu","MiKellner",2020-11-08 09:47:40,564,66
"1325340408675700741","digitale Wahlen für Parteien und Zivilgesellschaft ermöglichen, dafür mache ich Vorschläge <U+0001F447> https://t.co/KYlPK2pTig","MiKellner",2020-11-08 07:32:31,114,15
"1325183836171476993","Das Geschehen in Leipzig muss aufgeklärt werden. Danke an @Gruen_WGuenther und @Ka_Meier https://t.co/elpymPW6cA","MiKellner",2020-11-07 21:10:21,148,22
"1325143256028475393","Es ist gut zu sehen, wie sich die demokratischen Parteien in Deutschland gemeinsam über #BidenHarris freuen.","MiKellner",2020-11-07 18:29:06,246,6
"1325120381536129025","Yes!!! #uselection2020 #biden #BidenHarris https://t.co/LjPrzVbGI3 https://t.co/B52gixv1TR","MiKellner",2020-11-07 16:58:13,39,2
"1324793582662914052","Die richtige Musik <U+0001F3B6><U+0001F923> @igorpianist https://t.co/W54zb98Jvr","MiKellner",2020-11-06 19:19:38,30,5
"1324015908575158274","Meine Hoffnungen auf ein klaren Sieg von Biden haben sich nicht erfüllt. Eines ist klar, wir müssen für unsere Demokratie kämpfen. Das geht vor allem in und mit Parteien. Ergreift Partei, bei uns oder einer anderen demokratischen Partei:  https://t.co/84IZjW6xM5
#Elections2020 https://t.co/eIGP7qkEZG","MiKellner",2020-11-04 15:49:26,182,26
"1323893552947056640","Drücke #Biden, den #USA, uns Demokrat*innen beide Daumen, doch die Hoffnung von gestern Nacht auf einen strahlenden Sieg haben sich zerschlagen. Die USA bleiben zutiefst gespalten. Hatte schon bessere Tagesanbrüche. #Election2020 https://t.co/0HSDWIq07n","MiKellner",2020-11-04 07:43:14,32,3
"1323796452850700289","Das ist (mir zu) knapp #GetHimOut #GoJoe #ElectionNight","MiKellner",2020-11-04 01:17:23,82,1
"1323780308454563840","Für falschen Alarm hat CNN viele lustige Brzeichnungen  #keyracealert ist mein Favorit #ElectionNight <U+0001F6A8> <U+0001F6A8> <U+0001F6A8>","MiKellner",2020-11-04 00:13:14,40,1
"1323739760838561792","<U+0001F354> vorbereitet, CNN <U+0001F4FA> eingeschaltet, Spannung<U+26A1><U+FE0F> steigt #ElectionDay #uswahlen","MiKellner",2020-11-03 21:32:07,48,1
"1323573277793673217","Bin ich über die @gruene_jugend froh. <U+0001F64F><U+0001F33B><U+0001F44C>#Merz #JungeUnion","MiKellner",2020-11-03 10:30:34,395,14
"1323362128691109888","Das ist einfach entsetzlich - mit den Gedanken in #Wien. Gemeinsam gegen Antisemitismus. https://t.co/QCp41xcxOW","MiKellner",2020-11-02 20:31:33,42,2
"1323245663929458689","Wir haben gerade im Bundesvorstand entschieden, dass wir die Sendezentrale für den digitalen Parteitag von Karlsruhe nach Berlin verlegen. Ziel ist es, angesichts der Pandemielage die Reisetätigkeiten möglichst gering zu halten. Ich freue mich trotzdem auf eine tolle BDK. https://t.co/wOKpduT0i9","MiKellner",2020-11-02 12:48:45,175,10
"1322837913344872451","Grün und Gewerkschaften: eine starke Verbindung. Herzlichen Glückwunsch an Frank #Bsirske https://t.co/cO4SwdPNcd","MiKellner",2020-11-01 09:48:30,74,3
"1322583528484311042","Meine Kinder feiern Corona-conform #Halloween. Sie klingeln nur an unserer Tür, mittlerweile mit dem 3. Kostüm. #coronavirus","MiKellner",2020-10-31 16:57:40,896,31
"1321841168242692098","Wir brauchen einen #Unternehmenlohn von 1200 Euro für Kulturschaffende. #Boeckler-Studie zeigt, wie wichtig zielgerichtete #Hilfsmaßnahmen und deutliche Unterstützung geringer Einkommen ist. #Solidarität hält nur, wenn die Krisenkosten gerecht verteilt werden. https://t.co/RX09gXf3w8","MiKellner",2020-10-29 15:47:47,44,13
"1321523589837971456","Mit Generalverdacht gegen die Bevölkerung dämmt man nicht #Corona ein, sondern mit klugen und nachvollziehbaren Regeln. Überwachungsphantasien wie #Schleierfahndung und Kontrolle der privaten Wohnung sind der falsche Ansatz. #MPK","MiKellner",2020-10-28 18:45:51,75,13
"1320813431528837126","30 Jahre nach der Wiedervereinigung bleibt es (leider) Aufgabe migrantische und ostdeutsche Perspektiven zu stärken. https://t.co/qnNPIt06CO","MiKellner",2020-10-26 19:43:56,17,2
"1320618669018415104","Welch schreckliche Nachricht. Mein Beileid für seine Angehörigen und Weggefährten. https://t.co/3gCz6kDmyH","MiKellner",2020-10-26 06:50:01,93,3
"1320397524805496834","lesenswert <U+0001F447> https://t.co/vj46oTMyOr","MiKellner",2020-10-25 16:11:16,8,2
"1319557238227406848","Freue mich auf die Debatte mit @AnnaMohn zu Mobilität heute Abend! Bis später in Dallgow-Döberitz. https://t.co/I3sQ4uIE58","MiKellner",2020-10-23 08:32:16,9,1
"1317930309271359489","Lieber @petertauber Respekt für Deine Entscheidung und echtes Bedauern meinerseits. Du hast mir vor Jahren gesagt, ihr würdet als Christdemokraten die Tore nach rechtsaußen geschlossen halten. Du hast an deiner Haltung nie ein Zweifel gelassen. Ich wünsche Dir alles Gute. https://t.co/MwoymnlkZK","MiKellner",2020-10-18 20:47:26,111,6
"1317841205405909000","Mit @Jana_Hensel habe ich in der #Zeit über #Grüne im #Osten, die Fehler bei Hartz IV und meinem Wahlkampf in #Brandenburg gesprochen. Mehr im Interview https://t.co/8HzWHM78rR","MiKellner",2020-10-18 14:53:22,44,8
"1317823613366620162","must read: großartige Wahlanalyse <U+0001F44D><U+0001F447><U+0001F923> https://t.co/Gk3hHkCXKr","MiKellner",2020-10-18 13:43:28,14,6
"1316702664558817283","Über die Grünen Fehler 1990 haben Ostdeutsche Bündnisgrüne so manches Mal diskutiert. Ich finds gut, wenn die Debatte auch unter Westgrünen läuft ;-) <U+0001F33B><U+0001F44C> https://t.co/hxECPV4VbZ","MiKellner",2020-10-15 11:29:13,35,7
"1315028152566124544","Gestern Antragsschluss - heute erste Sitzung Antragskommission, wird ein langer Ritt. Wir wetten im Vorfeld immer auf die Anzahl der Anträge, der Gewinner bei der #BdK20 ist @till_steffen <U+0001F33B>. https://t.co/8nJs581zKD","MiKellner",2020-10-10 20:35:18,40,5
"1314496765295554561","Ein Jahr nach #Halle heißt Antisemitismus als reale Gefahr ernstzunehmen und jüdisches Leben zu schützen. Rechtsterrorismus entsteht dort, wo gehetzt wird und wo mit Verschwörungstheorien zunder gelegt wird. Meine Gedanken sind bei den Opfern und ihren Angehörigen. https://t.co/JHfy8PkEZy","MiKellner",2020-10-09 09:23:45,38,5
"1314143495083483136","Corona darf nicht eine ganze Generation um ihre Chancen bringen. Deshalb brauchen wir eine Starthilfe für Berufseinsteiger*innen. Und wir dürfen Europa nicht vergessen; in anderen Ländern ist die Situation noch schlimmer. https://t.co/00HTxh68Ht","MiKellner",2020-10-08 09:59:59,7,2
"1313740947579187201","Großartig! Das ist ein riesiger Erfolg. Danke @micha_bloss https://t.co/05nkW8pYrE","MiKellner",2020-10-07 07:20:24,116,11
"1313160852812582915","Deutschland braucht eine Verkehrswende, auf dem Land und in der Stadt. Deutschland braucht moderne Verkehrspolitik, mehr Bus, mehr Rad, mehr Bahn, weniger Beton. Und Deutschland braucht dafür eine*n neue*n Verkehrsminister*in https://t.co/QVCcEguMBt","MiKellner",2020-10-05 16:55:19,234,40
"1313096907246505989","Die richtige Grüne fürs Rote Rathaus. Freue mich sehr für Berlin und für meine ehemalige Vorstandskollegin @Bettina_Jarasch https://t.co/4uXf1AxXm9","MiKellner",2020-10-05 12:41:13,77,1
"1313085693732818944","Die Koalition aus #SPD und #Union ist sich ja selten grün, aber am Wochenende waren sich #Klingbeil und #Ziemiak ganz schnell einig: Autobahnen in Frage zu stellen, um die Klimakrise zu lösen, das geht gar nicht. Für mich zeigt das, wie #zukunftsvergessen diese Koalition ist.","MiKellner",2020-10-05 11:56:39,212,24
"1313003674881478656","Lieber Betonmischer @PaulZiemiak , wenn Du im 21. Jahrhundert immer noch neue Autobahnen bauen willst, dann hast du die Klimakrise nicht verstanden. Nötig ist ein neuer Bundesverkehrswegeplan – für #Klimaschutz: mehr Bus, Bahn und Rad, weniger Beton. <U+0001F447> https://t.co/mDLOuLSfme","MiKellner",2020-10-05 06:30:45,545,70
"1312778622420357122","Ich war heute im Danni bei der Demo, um Solidarität zeigen. Kein einfacher Auftritt. Der Schlüssel zum Stopp der #A49 liegt auf Bundesebene im Verkehrsministerium. Nach der Kundgebung bin ich in den wunderschönen Wald. Es braucht einen sofortigen Stopp. https://t.co/bXwEJJNrSS","MiKellner",2020-10-04 15:36:28,439,68
"1312288847355686918","Der #TagderDeutschenEinheit erinnert daran, dass wir für #Demokratie und Rechtsstaatlichkeit immer wieder neu eintreten müssen und für ein #Europa, das die #Menschenrechte schützt und an den Außengrenzen nicht mit Füßen tritt.","MiKellner",2020-10-03 07:10:17,46,14
"1312073634006130688","Was ist der Plural von Desaster, @AndiScheuer ? #Maut #Bußgeldkatalog #Autobahnreform #Seenotrettung - und das, um Hilfe zu erschweren. Es reicht https://t.co/Us9kRyiFcP","MiKellner",2020-10-02 16:55:06,92,36
"1312023259517521921","Stoppt die A49! Wir Grüne haben den Weiterbau der A49 immer für falsch gehalten und halten ihn weiter für falsch. Hier ist das Bundesverkehrsministerium verantwortlich, Andreas Scheuer muss handeln! #keineA49 
https://t.co/eqzqkbLYQg","MiKellner",2020-10-02 13:34:55,250,38
"1311562683779612672","Ein Jahr vor der #btw21 haben wir die Kampagne #mitdir gestartet und in weniger als 24h haben schon mehr als 2.000 Menschen gesagt, dass sie gemeinsam mit uns für die Grüne Sache kämpfen wollen!
Wir gehen zusammen neue Wege. Bist du dabei? https://t.co/LsKcJhMOXc","MiKellner",2020-10-01 07:04:46,113,42
"1311329612388073473","Früher hätte man gesagt: Geh doch nach drüben, Gerhard! #NordStream2 #Nawalny https://t.co/JagJh9uo3i","MiKellner",2020-09-30 15:38:37,76,8
"1310272725227900929","Sensationell. Bis gestern gab es in #Deutschland keine grüne #Oberbürgermeisterin, jetzt sind es zwei. Aachen und Bonn wird das gut tun! Grün wächst von unten. #stichwahl #ZukunftEntscheidetSichHier","MiKellner",2020-09-27 17:38:56,708,45
"1310185387692822530","30 Jahre Einheit - gemeinsam wandern Grüne aus Ost und West auf den Brocken - bis 1989 milit. Sperrzone - heute Nationalpark https://t.co/9NV9YZjspg","MiKellner",2020-09-27 11:51:53,67,5
"1309849417156100102","<U+0001F447> Beißt sich voll mit Markus Söders Drängen auf eine Abwrackprämie für Verbrenner. Naja, hier reden, da handeln, heute so, morgen so... kommt mir wie ein Södersches Muster vor.  #Wirrwarr #CSU https://t.co/kprASAq03E","MiKellner",2020-09-26 13:36:51,88,12
"1309445288923402241","#KeinGradWeiter Klimaschutz in Bewegung. Großartig sind die Bands am Straßenrand, die trotz trüben Wetters für gute Laune sorgen. https://t.co/kOIIoH75Xk","MiKellner",2020-09-25 10:50:59,121,2
"1309383820353957888","oh #Gera - was für ein beschämendes Ereignis. Erneut haben demokratische Parteien versagt. https://t.co/Vx1ejEyPmh","MiKellner",2020-09-25 06:46:44,56,4
"1308744652917551107","Am Freitag ist wieder globaler #Klimastreik. Wer von Euch ist dabei? 
Ich fahre auf der #Fahrraddemo in Berlin mit, Treffpunkt ist um 10:30 Uhr auf dem Washingtonplatz am Hauptbahnhof #KeinGradWeiter https://t.co/r4B2gswlZx","MiKellner",2020-09-23 12:26:55,23,3
"1308347203619037184","Was für eine tolle Entscheidung und so verdient! <U+0001F49A><U+0001F44D><U+0001F389>Bundesverdienstkreuz für  <U+2066>@igorpianist und<U+2069> <U+2066>@c_drosten<U+2069>  https://t.co/DKYqFePRi1","MiKellner",2020-09-22 10:07:35,2030,114
"1308006906330480640","#Merz denkt beim #Wahlalter16 als erstes an Strafen, beim Arbeiten in der Pandemie ans Faulenzen und bei einem schwulen Kanzler an Pädophilie. Trotz oder wegen dieser verbohrten #Weltsicht wäre er fast #CDU-Vorsitzender geworden. Schaue interessiert auf den Ausgang im Dezember.","MiKellner",2020-09-21 11:35:22,3892,500
"1307573695922270208","Derbe. Das Grundrecht zu wählen hat doch nichts mit Parteipräferenzen zu tun. Was für ein Demokratieverständnis. 
Jetzt weiß ich auch, warum @peteraltmaier keinen #Klimaschutz macht. Wäre ja Übernahme grüner Positionen. #Wahlalter16 https://t.co/j1jtWcPpKk","MiKellner",2020-09-20 06:53:57,425,50
"1306265009916448769","Bei der #PolizeiNRW ist jetzt auch eine rechtsextreme Chatgruppe aufgeflogen. @MathiasWagner,  @IreneMihalic und Alexandra Kurth haben mit mir diskutiert was gegen rechtsextreme Vernetzung zu tun ist. Z.B. ein unabhängiger Beauftragter Schaut es euch an: https://t.co/NdtWUMOfIJ","MiKellner",2020-09-16 16:13:42,10,7
"1305816349663473664","Mit allen demokratischen Parteien beim Festakt für 70 Jahre @ZentralratJuden. Gemeinsam nie vergessen und entschieden für sicheres jüdisches Leben in Deutschland. #Zentralrat70 https://t.co/9uHojrc4Y8","MiKellner",2020-09-15 10:30:53,34,3
"1305508054482456576","Ich bin für die neue Bonner Republik <U+0001F49A><U+0001F49A><U+0001F49A> @katjadoerner <U+0001F33B><U+0001F33B><U+0001F33B> https://t.co/jmGqDUY2dw","MiKellner",2020-09-14 14:05:50,75,3
"1305246651011956736","Eine Europaschule nach Templin - großartiges Projekt für Brückenbauer @fbrantner @ManuelSarrazin https://t.co/2LSBhiS4sB","MiKellner",2020-09-13 20:47:06,14,1
"1305175563842224134","Was für historisches Ergebnis bei den #KommunalwahlenNRW für uns @Die_Gruenen. Noch nie waren wir dabei so stark. 
#Kommunalwahl2020 #KW2020 #KW20NRW https://t.co/E3GVvYiziG","MiKellner",2020-09-13 16:04:38,1662,116
"1304504425449484297","Ich bin überwältigt von dieser grandiosen Unterstützung. Danke! Jetzt gebe ich volle Power, um nachhaltige Grüne Politik in der Uckermark und im Barnim zu stärken. <U+0001F33B> https://t.co/Ol2RKrSnQz","MiKellner",2020-09-11 19:37:46,208,12
"1304387029707485184","Großer Erfolg für das Klima im Umweltausschuss. Jetzt muss das Parlament nachziehen. @vonderleyen kann zeigen wie wichtig ihr Klimaschutz ist. Danke @micha_bloss https://t.co/dwAEt2bH4r","MiKellner",2020-09-11 11:51:16,66,13
