"status_id","text","screen_name","created_at","favorite_count","retweet_count"
"1086645859155173376","heute in Bochum - gemeinsam mit  @gruenenrw  bereiten wir die #Europawahl vor und das erstmalig mit 15.000 Mitgliedern. https://t.co/ieeYSpGQvC","MiKellner",2019-01-19 15:25:36,28,0
"1086217672256339969","Volle Solidarität für  #FridaysforFuture die Schüler*innen wollen nicht, dass ihre Zukunft verfeuert wird. Ich auch nicht","MiKellner",2019-01-18 11:04:08,86,10
"1086215339699027968","#GroKo 0 @ABaerbock 1 - so ist es #Herkunftsstaaten #Bundesrat https://t.co/7aqo2KoSO4","MiKellner",2019-01-18 10:54:52,11,1
"1085505595292205056","Der Einkauf von Werner #Patzelt durch die sächsische CDU wirkt wie eine Koalitionsvorbereitung mit der #AfD https://t.co/9tZi3cfbWz","MiKellner",2019-01-16 11:54:36,21,1
"1085264537211813889","Auszeit #GERFRA #handball https://t.co/dYhlOwmxC0","MiKellner",2019-01-15 19:56:43,63,1
"1085104761593126912","das wäre ein guter Anlass für #Dobrindt sich zu entschuldigen https://t.co/3TQWGHnJOk","MiKellner",2019-01-15 09:21:50,128,15
"1084902626507014144","Magdeburg - auch hier voller Schwung in die Kommunal- und Europawahl #grünwächst @GRUENE_LSA https://t.co/Ztn41pBLzu","MiKellner",2019-01-14 19:58:37,35,2
"1084401320008843264","Grün steht für eine offene, demokratische, gleichberechtigte Gesellschaft. Dafür wollen wir ein Bündnis der möglichst Vielen. Die klare Grenze verläuft bei Rassismus und Diskrimierung. Wir stehen dabei gegen eine Partei, die unsere Verfassung angreift. #Palmer","MiKellner",2019-01-13 10:46:36,497,77
"1084135437004886021","Vorbereitung Kommunal- und #Europawahl mit @GRUENE_MV - klarer Kurs für ein starkes Ergebnis im Norden. https://t.co/krUrbmYxB1","MiKellner",2019-01-12 17:10:05,25,4
"1083832178063171585","#ZukunftwirdAusMutgemacht mit @Gruene_SH über Werte, Inhalte und Ideen für das Grüne Grundsatzprogramm diskutiert. Danke für die tolle Veranstaltung. https://t.co/LDVkvRF4DU","MiKellner",2019-01-11 21:05:02,42,8
"1083401005579100160","Auweia @nicolabeerfdp - Klimakrise ist Realität - daran ändert sich auch nichts, wenn ihr aus ideologischen Gründen die Augen fest zukneift. https://t.co/VHaIvOdVP2","MiKellner",2019-01-10 16:31:43,80,18
"1083357319700930565","Gute Laune und produktive Stimmung beim Treffen mit unseren tollen europäischen Kandidatinnen und Kandidaten!  Kandidierende so vielfältig wie unsere Gesellschaft. #Europawahl https://t.co/xh82kJbOOD","MiKellner",2019-01-10 13:38:07,56,5
"1082992317991211010","Die #GroKo sollte sich mal diese sehr lesenswerte und erschreckende Auswertung über den Meeresspiegelanstieg anschauen. Vielleicht würde sie dann endlich Klimaschutz ernst nehmen.  https://t.co/VTjoXFIYvk","MiKellner",2019-01-09 13:27:44,37,6
"1082965764821405696","gemeinsam für Europa als starke Gemeinschaft - heute Austausch mit @Gruene_Austria https://t.co/FJ2K6O0VOH","MiKellner",2019-01-09 11:42:13,23,5
"1082916788030136320","Die gemeinsame Arbeit an diesem Papier fand ich wirklich gewinnbringend - und das würde ich jetzt noch über jedes Papier sagen ;-) Danke  @ABaerbock @jamila_anna @Gesine_Agena @Marc_Urbatsch @RobertHabeck https://t.co/Y2vqCVHES0","MiKellner",2019-01-09 08:27:36,29,2
"1082308944134049792","#NazisRaus https://t.co/qpZrkoklHR","MiKellner",2019-01-07 16:12:15,97,9
"1082205317814013953","Zum Auftakt unserer Vorstandsklausur in Frankfurt/Oder berichtet @ReneWilke über praktische Europabegeisterung und gelingende Integration. https://t.co/GAdrmJPPZV","MiKellner",2019-01-07 09:20:28,49,8
"1081470639024848896","<U+0001F680> Das gibt Kraft. In einem Jahr 10.000 Mitglieder gewonnen - der größte Zuwachs in zwei Jahrzehnten. Wir sind jetzt 75.000 Grüne, die sich für echten Klimaschutz, den Erhalt Europas als starke Gemeinschaft, mehr Demokratie und ein solidarisches Miteinander einsetzen. https://t.co/qNGr0SOTko","MiKellner",2019-01-05 08:41:07,1461,277
"1081159023330840576","Dieser #Hackerangriff ist ein massiver Eingriff in die demokratischen Grundrechte und die Persönlichkeitsrechte. 
Wer das macht, will das Vertrauen in unsere demokratischen Institutionen und in die freie Presse erschüttern. Nicht einschüchtern lassen.","MiKellner",2019-01-04 12:02:52,316,53
"1080495389755801601","Die Wahlen im Osten werden über die weitere Entwicklung unseres Parteiensystems entscheiden. https://t.co/GLG6qlg9ME","MiKellner",2019-01-02 16:05:50,38,3
"1079862373115150336","alles Gute für 2<U+FE0F><U+20E3>0<U+FE0F><U+20E3>1<U+FE0F><U+20E3>9<U+FE0F><U+20E3> - lasst uns böse Geister vertreiben <U+0001F340> <U+0001F942> https://t.co/trojdu2PWg","MiKellner",2018-12-31 22:10:27,20,0
"1075809137244729344","heute in Dresden gemeinsam mit @gruene_sachsen - wir gehen voller Energie in die anstehenden Wahlen 2019, doch jetzt erst einmal schöne Weihnachten https://t.co/JaGUEBfxLc","MiKellner",2018-12-20 17:44:20,42,11
"1075472472508518400","in Erfurt gemeinsam mit @Gruene_TH - voller Elan in die Wahlen 2019 und das kurz vor Weihnachten &amp; morgen zum Abschluss der Woche Dresden mit @gruene_sachsen https://t.co/3SgoWF6fvo","MiKellner",2018-12-19 19:26:33,33,2
"1075114586045595648","heute @GRUENE_Hamburg, morgen @Gruene_TH und gestern @GrueneBBG - Vorbereitungen Europa- und Kommunalwahlkämpfe. Wahlkampfzeit ist doch die schönste Zeit. https://t.co/QjhJvgfrrp","MiKellner",2018-12-18 19:44:26,15,0
"1075062004283527168","Das grüne Magazin zum Thema Wildnis gibt es hier u.a.  mit Fakten zum Thema Artenschwund, warum Alexander v. Humboldt grüner Vordenker war oder einen Gastbeitrag von der norwegischen Schriftstellerin @majalunde https://t.co/flnRDaEz60","MiKellner",2018-12-18 16:15:30,8,2
"1074750778605219843","gemeinsam mit @GrueneBBG - gut gelaunt und voll motiviert gehen wir in die Kommunal- und #Europawahl - morgen dann @GRUENE_Hamburg https://t.co/5HPYqIdZNk","MiKellner",2018-12-17 19:38:48,17,2
"1074323521734623233","großartige Stimmung bei @FuechseBerlin &amp; @Nischwe vielleicht  für nächsten Parteitag - so könnten wir die Delegierten einlaufen lassen ;-) https://t.co/fNoUU3TScz","MiKellner",2018-12-16 15:21:02,14,0
"1074238356001824768","36 % aller Tierarten und 27% aller Blühpflanzen sind in #Deutschland akut bedroht und die #Groko schafft es nicht mal Bienengifte zu verbannen. Was für ein Versagen vor der Zukunft.  #Artenerhalt
https://t.co/QapwkIuSed","MiKellner",2018-12-16 09:42:37,217,102
"1074049873140420608","Gut, die #Weltklimakonferenz hat einen Kompromiss gefunden. Schlecht, #Groko verpennt #Klimaschutz energisch voranzutreiben. #COP24 https://t.co/zlNPWX3ZKU","MiKellner",2018-12-15 21:13:39,12,4
"1073950477220503552","#AfD ist eine gekaufte Protestpartei https://t.co/JTdeFkMl0C","MiKellner",2018-12-15 14:38:41,34,9
"1073560055088328704","Wenn die <U+0001F41D> nicht mehr Summen und das<U+0001F4A7>nicht fließt ändert sich alles. @majalunde hat das in zwei großartigen Romanen beschrieben. Im neuen grünen Magazin spricht sie darüber und wie die Realität die Fiktion überholt. Lesenswert! https://t.co/YouZBlmbXs #heißzeit","MiKellner",2018-12-14 12:47:17,4,1
"1073521700736823297","Wenn die Bundesregierung weiter keinen Klimaschutz betreibt, wird #heißzeit in Zukunft nicht mehr #WortdesJahres, sondern Beschreibung für jeden Sommer sein.","MiKellner",2018-12-14 10:14:53,24,3
"1073510880875372545","Tolle Aktion #FridayForFuture https://t.co/b5M2g4SM1l","MiKellner",2018-12-14 09:31:53,8,1
"1073127925996814336","Selbstbestimmung von Frauen wird in der GroKo ganz klein geschrieben. #219a https://t.co/MrCrPJ14tY","MiKellner",2018-12-13 08:10:09,21,3
"1072867636763971584","#AfD entlarvt sich einmal mehr als Partei, die Demokratie und Rechtsstaatlichkeit angreift. #Verfassungsfeinde https://t.co/8ox9eMM23a","MiKellner",2018-12-12 14:55:52,22,8
"1072481843553943552","krasse Zahlen - schon eine kleinere Veränderungen der #Erbschaftssteuer könnte Milliarden für Schulen oder Klimaschutz bringen, denn jeder und jede sollte einen fairen Beitrag für unsere Gesellschaft leisten, auch Erben. https://t.co/j0Vfh7idzR","MiKellner",2018-12-11 13:22:51,63,22
"1071716374861529090","Ich trauere um Ljudmila Alexejewa. Dissidentin, Menschenrechtsaktivistin, Historikerin. Was für ein Verlust!Angesichts von zunehmenden Autoritarismus brauchen wir mehr Dissidententum und weniger Opportunismus.","MiKellner",2018-12-09 10:41:09,60,4
"1071343117520044033","Herzlichen Glückwunsch @Ziemiack Viel Spaß mit der Aufgabe in diesen politisch spannenden Zeiten. #CDUbpt18","MiKellner",2018-12-08 09:57:58,5,0
"1071076933448933376","herzlichen Glückwunsch an @_A_K_K_ freue mich, wenn Generalsekretäre gewinnen ;-)  #CDUbpt18","MiKellner",2018-12-07 16:20:15,32,0
"1071061232604643328","Danke @SteffiLemke - du hast mir ein elektronisches Abstimmungsverfahren hinterlassen und keine Tischwahlkabinen. #cdubpt18","MiKellner",2018-12-07 15:17:51,283,16
"1071013666466750464","#DankeChefin kann ich nun nicht sagen, aber Respekt und Danke Angela Merkel. Sie hat aus der westdeutschen CDU eine gesamtdeutsche Partei gemacht.","MiKellner",2018-12-07 12:08:51,28,0
"1070736589788209153","Hammer. Was für ein Zuspruch für die französischen Grünen. #grüneWelle für Klimaschutz und ein sozialeres Europa #Europawahl https://t.co/d4ieEfsjmR","MiKellner",2018-12-06 17:47:50,97,18
"1070241814416896000","Bemerkenswert. In der CDU geht es jetzt offen um die Abwicklung von Merkels Erbe. #Schäuble arbeitet an einem Rücksturz in die 90er Jahre. https://t.co/Uzogi6uhS7","MiKellner",2018-12-05 09:01:47,7,2
"1069896571679109120","Grün stärkste Partei bis 39. schöne Bestätigung unsere Arbeit, weil wir versuchen eine Politik für heute, mit klarem Kurs für ein besseres Morgen zu machen. Einziger Wermutstropfen ich bin 40. https://t.co/iMLiIVb2xO","MiKellner",2018-12-04 10:09:55,118,6
"1069690112580247553","immer ein Vergnügen - Telefonkonferenz mit Neumitgliedern, viele Fragen, wahnsinnig viel Motivation und ganz viel Lust auf Wahlkampf. https://t.co/9AmTWI4ASl","MiKellner",2018-12-03 20:29:31,47,1
"1069521154103234560","Zustimmung: Klimaschutz ist die zentrale Frage der Menschheit. Aber markige Sprüche ohne konkrete Handlungen stoppen keine Klimakrise. Statt Verantwortung auf internationale Ebene zu schieben, muss die BReG beim Klimaschutz liefern. #COP24 #Kohleausstieg https://t.co/wCfoBuk0Sj","MiKellner",2018-12-03 09:18:08,31,4
"1067420797348847616","während #Dobrindt durch die Gegend irrlichtert, kann man sich über den UN-Migrationspakt informieren: https://t.co/OOVSWv9PNW Danke @GrueneBundestag","MiKellner",2018-11-27 14:12:04,44,12
"1066350730838253568","sauber @SkaKeller und @BasEickhout sind unsere europäischen grünen Spitzenduo. Ein starkes Team für ein ökologisches, soziales und menschliches Europa. #egp29 https://t.co/iZJJWDYRSN","MiKellner",2018-11-24 15:20:00,90,14
"1066265542259023873","Die #AfD behauptet Stimme des Volkes zu sein, doch sie ist vielmehr Stimme eines Milliardärs.  https://t.co/aj9EqXZBwi","MiKellner",2018-11-24 09:41:30,579,180
"1066054951191961601","beeindruckendes Treffen der Europäischen grünen Parteien in Berlin - macht Vorfreude auf die #Europawahl #EGP29 https://t.co/jMAHRgzVo8","MiKellner",2018-11-23 19:44:41,72,9
"1065321740144963584","Das Grundrecht auf Asyl ist Ausdruck von Menschlichkeit. Mit dem aus der Hochphase des Neoliberalismus aufgetauten Argument von #Merz könnte man noch jeden Standard schleifen, egal ob Humanität, faire Besteuerung oder Klimaschutz. https://t.co/Gtl8KtpBTc","MiKellner",2018-11-21 19:11:10,36,9
"1065259205655973888","schwarze Kassen, dubiose Stiftung, plumpe Verteidigungsstrategie - bin ja gespannt, wer jetzt am AfD-Spendenskandal schuld sein soll. Die bösen Medien, andere Parteien, der Weihnachtsmann? Eigenverantwortung kennt die #AfD ja sicher nicht. https://t.co/VmjE10a3Ll","MiKellner",2018-11-21 15:02:40,29,5
"1064572518231621632","der SPD-Vorstand macht einen Vorschlag für die Europaliste -  bei den Grünen würde der Vorstand dafür von den Delegierten vermutlich aus der Halle gejagt. Mit Recht. Wie wäre es mit offenen Wahlen? Schließlich sollen Mitglieder über Personal entscheiden.
https://t.co/nomRPsK6D6","MiKellner",2018-11-19 17:34:01,91,23
"1064546827096285184","sehr gute Entscheidung - da freue ich mich über das Handeln der #Bundesregierung #SaudiArabien https://t.co/uQDhvVRwgC","MiKellner",2018-11-19 15:51:56,11,2
"1064444037929844736","Olaf Scholz sollte sich nicht zum Schutzheiligen von Amazon, Facebook und co machen - es braucht eine faire Besteuerung dieser Konzerne #Digitalsteuer  https://t.co/781aGCGdVJ","MiKellner",2018-11-19 09:03:29,33,8
"1063381616658182144","Crazy Horst will Innenminister bleiben, dabei ist er ein Risiko nicht nur für seine Partei, sondern für die innere Sicherheit #Seehofer","MiKellner",2018-11-16 10:41:48,34,3
"1063378485467598848","Es gibt Termine und es gibt den #Vorlesetag - lese heute Ella und die Schulnacht https://t.co/PH792p8LTZ","MiKellner",2018-11-16 10:29:22,7,0
"1063021691713003520","AfD - tarnen, tricksen, täuschen schwarze Kassen, Strohmänner und Scheinfirmen https://t.co/EH54MLE5XO","MiKellner",2018-11-15 10:51:35,31,5
"1063008599201538048","Studie der @FESonline zeigt erneut: Menschen mit niedrigem Einkommen leiden an dreckiger Luft. Sozial und ökologisch gehören zusammen.
https://t.co/8gxqXQMbcN","MiKellner",2018-11-15 09:59:34,72,24
"1062711341914509312","heute Planungsstab #Europawahl - mit vollem Schwung nach #bdk18","MiKellner",2018-11-14 14:18:22,11,1
"1061934309559463936","Man kann leicht den Überblick über alle  Finanzskandale der #AFD verlieren. Dubioser Unterstützerverein, Fraktionsfinanzen und jetzt Spenden aus der Schweiz. Aufklärung: Null. Ausreden: Viele.","MiKellner",2018-11-12 10:50:43,132,28
"1061660285814128640","Danke @GrueneBBG Bordverpflegung. Spätes Mittagessen oder frühes Abendbrot?  #zeitloch #bdk18 https://t.co/oHSKIWssJB","MiKellner",2018-11-11 16:41:51,35,0
"1061560602102038528","Danke Netzbegrünung für diesen Service - bin echt froh, dass ihr mir nicht den Kopf abschneidet. <U+0001F923><U+0001F923><U+0001F923> https://t.co/wjhlDZYSlx","MiKellner",2018-11-11 10:05:45,74,2
"1061400809844424704","#bdk18 tanzt https://t.co/ymPY82UyO4","MiKellner",2018-11-10 23:30:47,86,1
"1061382308840853505","so toll <U+0001F60A> <U+0001F44F><U+0001F3FB> https://t.co/satWxB0raj","MiKellner",2018-11-10 22:17:16,61,2
"1061238421987999745","Wir überlassen Europa nicht den Orbans, le Pens oder Salvinis. 
Und ich sage heute: wir überlassen den Osten nicht den Hetzern, Spaltern und Rechtsextremen. Das ist auch ein Signal von der #BDK18. https://t.co/y2q2jDeQfN","MiKellner",2018-11-10 12:45:31,361,57
"1061211626651766784","sehr, sehr starke Reden von @SkaKeller und @sven_giegold - freue mich richtig auf diesen Europawahlkampf #bdk18","MiKellner",2018-11-10 10:59:02,41,4
"1060971735741333506","Der Bundesparteitag in Leipzig startete mit wunderschönen kraftvollen Botschaften für ein besseres Europa von @igorpianist Seine Musik waren mit die schönsten, beeindruckendsten und vor allem entspanntesten Minuten auf einem grünen Parteitag für mich.","MiKellner",2018-11-09 19:05:48,44,3
"1060904167202533376","Der beste Flügel ist heute bei uns auf der Bühne. #Bdk18 @igorpianist https://t.co/3FGSz0I3f0","MiKellner",2018-11-09 14:37:18,195,14
"1060496549489328128","Glückwunsch an #Weber. Er sollte jetzt Flagge für Europa zeigen und #Orban aus der #EVP werfen. #EPPHelsinki https://t.co/Cj0ohEo30j","MiKellner",2018-11-08 11:37:35,28,5
"1060472348523089920","#Weidel und #Wagenknecht mobilisieren gegen den UN-Migrationspakt. Das offenbart eine  gemeinsame nationalistische Haltung, in der es nicht um universelle Rechte geht https://t.co/YWI08bNsQI","MiKellner",2018-11-08 10:01:25,27,11
"1060469551475896325","Europa ökologischer, demokratischer und sozialer - darum geht es bei der #Europawahl. Freue mich sehr auf die Zusamnenarbeit für die Kampagne mit der Agentur DieckertSchmidt @sos25","MiKellner",2018-11-08 09:50:18,5,1
"1060189654664781824","Wenn man 48 h vor Beginn eines Parteitags Kindergeburtstag feiert, dann weiß man, dass man einen Planungsfehler bei der Terminierung der #bdk18 gemacht hat. #lasttweet","MiKellner",2018-11-07 15:18:05,77,0
"1060163176191455234","Richtig. Klingt ja eher nach Ungarn als nach Deutschland - keine Einschüchterung der Zivilgesellschaft. #Greenpeace https://t.co/e9pbG5gRQK","MiKellner",2018-11-07 13:32:52,19,5
"1059811587517747200","Ich freue mich über den Auftritt von Jörg Hofmann @IGMetall auf unserem Parteitag. Gemeinsam kämpfen wir für ein soziales Europa, das zunehmend Rechtsnationalisten attackiert wird. Zugleich ist die sozial-ökologische Transformation eine der größten anstehenden Aufgaben. #BDK18","MiKellner",2018-11-06 14:15:47,18,1
"1059753442577653760","""Ich habe nie verheimlicht, dass ich aus Thüringen komme - aber ich habe auch nie absichtlich darüber geredet."" Über Disruptionen in meiner Biographie, grüne in Ostdeutschland und unsere Herausforderungen bei den kommenden Landtagswahlen
https://t.co/XKQKmL3GJ9","MiKellner",2018-11-06 10:24:44,81,29
"1059390432482918400","finde ja, die SPD Fraktion sollte jetzt eine Anfrage beim Innenministerium stellen welche Erkenntnisse der #Verfassungsschutz über linksradikale Strukturen innerhalb der SPD hat. #Maaßen","MiKellner",2018-11-05 10:22:16,170,22
"1059144734759944193","#Maaßen - was für eine absurde Pointe. Der Mann ist als Beamter schon lange nicht mehr tragfähig. #GroKo","MiKellner",2018-11-04 18:05:57,78,5
"1058337273903828994","mit jeden weghoppeln der #FDP vor Verantwortung, verliert sie an Bedeutung https://t.co/kCMfqmFdwi","MiKellner",2018-11-02 12:37:23,45,8
"1058300687719825409","Was sagt eigentlich die @igbce dazu? Kohlekumpel sprechen sich für einen zeitnahen Kohleausstieg und überlegten Strukturwandel aus. Das ist kein grüner Ortsverband. #Kohlekommission  https://t.co/R3UKjkDdMj","MiKellner",2018-11-02 10:12:00,26,10
"1057949697099395073","Bisher hat die Erfahrung doch überall gelehrt: Privatisierung nützt nur den neuen Eigentümern. Für den Staat und die Verbraucher wirds teurer und schlechter. Scheuer sollte die Privatisierungspläne endlich stoppen.
https://t.co/05eMmDkN3U","MiKellner",2018-11-01 10:57:18,62,25
"1057737317283254273","finster, finster Geisterstunde meinten meine Kinder heute, finde das passt auch ganz gut zur Situation der #GroKo  <U+0001F47B> <U+0001F383>","MiKellner",2018-10-31 20:53:22,7,1
"1057602240138092546","AfD &amp; rechtsradikal - selbst die Mehrheit der #AfD-Anhänger bescheinigt der Partei ungenügende Abgrenzung von Rechtsextremen, Nationalisten und Identitären.  #nonazis https://t.co/D3B27MlZDY","MiKellner",2018-10-31 11:56:38,6,2
"1057202351864455169","Einfach erschreckende Zahlen. 60% weniger Wildtiere als 1970 - wir müssen mehr Fläche unter Naturschutz stellen https://t.co/XealvOSw2D #naturschutz #artenschutz","MiKellner",2018-10-30 09:27:37,28,13
"1057020796340723722","Digitalisierung &amp; 1989 - wie das zusammenhängt und einiges mehr im Gespräch mit @DoroBaer <U+0001F447> https://t.co/2gMTEOwXym","MiKellner",2018-10-29 21:26:11,16,4
"1056878379545358338","bei dpa äußern sich heute nur noch Kreise. Respekt für Merkel. https://t.co/ztsdyu1usM","MiKellner",2018-10-29 12:00:16,25,1
"1056654886060867584","Laut #ARD bzw. Infratest Grüne stärkste Partei in den Altersgruppen 18-24 &amp; 25-34 und stärker als SPD und CDU bei Arbeitslosen.","MiKellner",2018-10-28 21:12:11,80,18
"1056646413008941057","Die Lehrerüberwachung der #AfD ist das größte Denunziantenprojekt seit der Stasi im Osten.","MiKellner",2018-10-28 20:38:31,361,74
"1056571568736870400","diese Tierdokus bei der ARD vor Wahlabenden beruhigen ganz ungemein #ltwHE","MiKellner",2018-10-28 15:41:06,66,4
"1056154086645645313","Durchschaubares Manöver von Bild https://t.co/PfTssmamU4","MiKellner",2018-10-27 12:02:11,73,11
"1055401708602490880","Die BRef verschläft schnelles Internet, gute Bahnanbindung oder Ärztemangel in der Lausitz und anderswo seit Jahren. Der schnelle Kohleausstieg ist eine Chance für den Strukturwandel, wenn die #GroKo aufwacht #kohlekommission","MiKellner",2018-10-25 10:12:30,24,4
"1055035220477558784","73 Jahre globales arbeiten an Frieden und Entwicklung. <U+0001F54A> Angesichts von neuen Aufrüstungswettbewerben, Kriegen und staatlichen Auftragsmorden wichtiger denn je. Herzlichen Glückwunsch @UN https://t.co/hN9wKyfdCu","MiKellner",2018-10-24 09:56:12,42,7
"1054659423459786752","Es gibt unappetitliche, aber wichtige Studien - #Mikroplastik in Kosmetik sollte endlich verboten und der Verpackungswahnsinn in Supermärkten gehört gestoppt
https://t.co/B9v4MlWxjH","MiKellner",2018-10-23 09:02:55,47,13
"1054301056124010496","eine solidarischen Gesellschaft - die Ökologie mit Gerechtigkeit und Vielfalt verbindet, ist ein Thema für alle. Deshalb sind grüne Wähler*innen jung und alt - verdienen weniger, mehr oder durchschnittlich, mit Abi oder ohne.
https://t.co/7DS221jBEb","MiKellner",2018-10-22 09:18:54,25,2
"1053341259941711873","„Doch die Grünen für Engel zu halten, nein, dazu besteht wahrlich kein Anlass.“ da hat der @Herr_Decker wohl recht https://t.co/1TPTpWKa6o","MiKellner",2018-10-19 17:45:01,21,5
"1053323421013159936","Wir freuen uns so sehr -  @igorpianist kommt am 9.11 zum Parteitag nach Leipzig #bdk18 @ABaerbock @RobertHabeck","MiKellner",2018-10-19 16:34:08,193,15
"1053229344884170754","Nicht @tazgezwitscher sondern @handelsblatt - bemerkenswert - der Bundestag als Fabrik des 20.Jh - genau so sieht die Klimapolitik der #Groko aus. Sie versagt zu Lasten unserer und der Generation unserer Kinder https://t.co/SPMQuXZwPl","MiKellner",2018-10-19 10:20:18,67,22
"1052820142294540289","mal ohne Kommentar https://t.co/naGd43GzBc","MiKellner",2018-10-18 07:14:17,137,24
"1052524966774755334","Rückenwind für Europa - 82% der Deutschen unterstützen die EU und zugleich sagen 52% Prozent; die EU muss endlich handeln beim Klimaschutz.
https://t.co/0b3IYKqun0","MiKellner",2018-10-17 11:41:21,31,6
"1052480573732581376","die #AfD schafft es nicht, sich von Rechtsextremen abzugrenzen - es wimmelt in ihren Reihen nur so von Rechtsextremen, Neuen Rechten, Identitäten und Faschisten https://t.co/iJPE7OrQiw","MiKellner",2018-10-17 08:44:57,18,2
"1052271434221916160","Es ist nicht mein Problem, wenn #Seehofer Parteichef der CSU bleiben will, das ist das Problem der CSU. Mein Problem ist, dass er weiterhin Innenminister bleiben will. Seine Politik ist ein Sicherheitsrisiko für unsere Gesellschaft.","MiKellner",2018-10-16 18:53:54,760,150
"1051682229267652608","Glückwunsch @LudwigHartmann - was für ein Erfolg. Die #CSU erscheint mir wie ein alter Diesel - in Innenstädten kommt sie bald nicht mehr vor. https://t.co/REv5IhuLqJ","MiKellner",2018-10-15 03:52:37,150,21
"1051509272591384576","Was für ein Vertrauen in Grün. Ganz herzliche Glückwünsche an @Gruene_Bayern - Respekt und Dankbarkeit vor dem Vertrauen der vielen Wählerinnen und Wähler. Die #CSU dachte, sie ist Bayern. Nur Bayern dachte das nicht mehr. #ltw18by","MiKellner",2018-10-14 16:25:21,247,30
"1051144773275459584","Großartig - es waren wohl noch viel mehr - über 200.000. Überwältigend. #unteilbar https://t.co/PPQ7YsHenq","MiKellner",2018-10-13 16:16:57,40,3
"1051134002973822978","erfolgreiches Demoende - gerade neues Mitglied für @gruenehessen und @grueneffm geworben #penetrant #unteilbar","MiKellner",2018-10-13 15:34:10,30,2
"1051112886578438144","Wahnsinn 150.000 Menschen in Berlin auf der Straße- was für ein Signal - Herz statt Hetze #unteilbar https://t.co/eFZucrobaB","MiKellner",2018-10-13 14:10:15,56,5
"1051067493362688000","Gute Laune unter strahlender Sonne #unteilbar https://t.co/aIYquyJ6rr","MiKellner",2018-10-13 11:09:52,381,42
"1051058907035181056","mit den tollen Bundesarbeitsgemeinschaften zu Grundsatzprogramm und #bdk18 - und jetzt gemeinsam zu #unteilbar https://t.co/m0iyuWRinW","MiKellner",2018-10-13 10:35:45,17,1
"1051027174717878272","heute geht mit #unteilbar eine linke Bewegung auf die Straße und die Frühsportgruppe #Wagenknecht schlägt sich in die Büsche - entlarvend - https://t.co/xL7Z8AREuf #Aufstehen","MiKellner",2018-10-13 08:29:40,56,12
"1051017170682040321","bis gleich bei #unteilbar Grüner Treffpunkt ab 12 Uhr Alexanderstraße, Höhe Park Inn #Servicetweet https://t.co/T36grXwyQQ","MiKellner",2018-10-13 07:49:55,39,5
"1050675824616075264","Es braucht strenge Grenzwerte und vor allem klare Kontrollen und scharfe Strafen damit gesundheitsgefährdende Chemikalien aus unserer Umwelt verschwinden https://t.co/Cbb0NzPZsY","MiKellner",2018-10-12 09:13:31,20,5
"1050430384960364544","so ein Ansporn für Grün, mehr Mitglieder, gute Umfragen, tolles Team, wir hängen uns weiter rein, damit wir diesem Vertrauen gerecht werden https://t.co/6XL7LCKZqw","MiKellner",2018-10-11 16:58:14,64,9
"1050391777289621506","#BerlinerRunde irgendwie freu ich mich darauf #ltwby18 <U+0001F33B> <U+0001F40D> https://t.co/GQPjaAhTgP","MiKellner",2018-10-11 14:24:49,41,2
"1050326509196627969","penetrant? Pfff. <U+0001F913>- tolles Interview von @Afelia Mitgliederwerbung lohnt sich https://t.co/F42lG1VCA5 https://t.co/S04Chujubt","MiKellner",2018-10-11 10:05:28,47,8
"1050015800004734978","etwas mehr als 900 Änderungsanträge - wenn wir fertig sind, ist das Baby groß #bdk18 https://t.co/EaDowG1Ap2","MiKellner",2018-10-10 13:30:49,28,1
"1049949154397618176","Würde mich freuen möglichst viele von Euch am Samstag zu sehen #unteilbar https://t.co/Fc0GYO03Fc","MiKellner",2018-10-10 09:06:00,13,3
"1049920542780915712","mein Team - mein Verein. Danke @albaberlin für dieses Zeichen #unteilbar https://t.co/Uyqf7Hs8Qx","MiKellner",2018-10-10 07:12:18,26,4
"1049290389864296448","Punk oder Punkt: Antragslektüre - bis jetzt mein Highlight - Danke Claudia Roth - bin für Abstimmung #BDK17 https://t.co/B8oEcIJilp","MiKellner",2018-10-08 13:28:18,102,13
